,subreddit,author,domain,title,num_comments,score,timestamp
5121,nottheonion,Reduviidae87,foxlexington.com,Gov. Beshear hung in effigy as 2nd Amendment supporters rally at Ky. Capitol,10,1,1590386567
5122,nottheonion,Reduviidae87,msn.com,Kentucky Gov. Andy Beshear hanged in effigy as Second Amendment supporters protest coronavirus restrictions,1,1,1590386343
5123,nottheonion,AnAnonymousGamer1994,today.com,"Betty White, 98, is 'doing very well' despite the coronavirus pandemic",2,1,1590383271
5124,nottheonion,DrBatman0,engadget.com,Texas Instruments makes it harder to run programs on its calculators,2,1,1590381234
5125,nottheonion,queefs4ever,miaminewtimes.com,"Queef Latina, Miami Drag Performer, Stars in Film Emergence",2,1,1590381109
5126,nottheonion,BlueLight03,seattletimes.com,‘Hundreds of millions of dollars’ lost in Washington to unemployment fraud amid coronavirus joblessness surge,2,1,1590380503
5127,nottheonion,BlueLight03,thepostmillennial.com,Washington's unemployment insurance lost over $100 million to a Nigerian scam,2,1,1590380279
5128,nottheonion,WeirdWyr,dailyprogress.com,Police: Man wearing watermelon on his head arrested in Louisa Sheetz robbery,8,1,1590379650
5129,nottheonion,jalapeno2217,google.com,A Nebraska Woman is suing all homosexuals on behalf of god and Jesus Christ,2,1,1590378630
5130,nottheonion,AnishNoor92,youtube.com,Pardes (1997) Cast Then And Now | Unrecognized Transformation in 2020,2,1,1590378242
5131,nottheonion,mt3334,mondestuff.com,Recovering from COVID-19 may take you longer than you anticipated,1,1,1590377338
5132,nottheonion,pauseforfermata,nypost.com,Bolivian orchestra stranded at ‘haunted’ German castle surrounded by wolves,2,1,1590375724
5133,nottheonion,Gigabeto,msn.com,Mike Singletary leaves Texas high school team after going 1-21,2,1,1590375531
5134,nottheonion,MattaMongoose,arstechnica.com,"Penguin poop creates a buttload of laughing gas, researchers find",1,1,1590375253
5135,nottheonion,DDKinz64,kron4.com,"Recent Spike In Crime Linked To Released Inmates, Alameda County Officials Say",47,1,1590375061
5136,nottheonion,CharsiCuba,dailyhive.com,Pigeon birth control program expanded at Vancouver SkyTrain stations,4,1,1590374493
5137,nottheonion,ninjadrog09,globalnews.ca,Huge owl hatches chicks outside man’s window — now the brood watches TV with him,1,1,1590373290
5138,nottheonion,rogue_master17,itechpost.com,Alyssa Milano Is NOT the ONLY ONE Wearing a Crocheted Mask: Ex-Charmed Actress Speaks up against Twitter bashers,0,1,1590372726
5139,nottheonion,PhoShizzity,cnbc.com,Cheese pirates steal 20000 pounds of cheese in Wisconsin,1,1,1590372631
5140,nottheonion,SligPants,mytwintiers.com,Son charged with murdering dad during Zoom call with about 20 other people,12,1,1590372227
5141,nottheonion,shuxue,usatoday.com,"Desperate rats are brazenly searching for food during the coronavirus pandemic, CDC warns",12,1,1590371174
5142,nottheonion,shuxue,nytimes.com,C.D.C. Warns of ‘Aggressive’ Rats Searching for Food During Shutdowns,2,1,1590371041
5143,nottheonion,1970251510,youtu.be,#มีกษัตริย์ไว้ทำไม,3,1,1590369133
5144,nottheonion,SayLittleDoMuch,dailywire.com,"Leftist Writer: Even If Biden ‘Boiled Babies And Ate Them,’ He Would Get My Vote",2,1,1590368758
5145,nottheonion,TheDesertMonk,businessinsider.com,Burger King debuts social-distancing crowns,2,1,1590368045
5146,nottheonion,1970251510,youtu.be,#มีกษัตริย์ไว้ทำไม,3,1,1590367723
5147,nottheonion,NaBUru38,in.reuters.com,Esports: Formula E driver disqualified for getting impostor to race for him,1,1,1590367709
5148,nottheonion,yankeegentleman,washingtonpost.com,Browns to Auction off Playcalling for Coronavirus relief,2,1,1590363803
5149,nottheonion,AceMatthew,cnet.com,"Over 40% of Republicans think Bill Gates will use COVID-19 vaccine to implant tracking microchips, survey says",15,1,1590363787
5150,nottheonion,annihilistvoid,indianexpress.com,"Jackfruit falls on man injuring him; at hospital, he tests positive for Covid",22,1,1590362634
5151,nottheonion,confibulator,businessinsider.com,Burger King debuts 'social-distance crowns' in Germany as restaurants test quirky ways to keep customers apart,2,1,1590361315
5152,nottheonion,SiddharthaSuburbia,variety.com,Bolivian Orchestra Stranded in ‘Haunted’ German Castle Surrounded by Wolves During Pandemic,1,1,1590359767
5153,nottheonion,yokak60758,the-exchanger.com,If You Are Able To Get 8 out 12 On This Gardening Quiz You Definitely Have A Green Thumb QUIZ,2,1,1590358971
5154,nottheonion,MapleStoryPSN,heraldmailmedia.com,Rapper KJ Balla gunned down in Brooklyn after rhyming in recent video that he ‘cannot die in the street’,5,1,1590358562
5155,nottheonion,ssduncann,google.com,"Penis face mask sales save Utah non-profit, founder says",2,1,1590358234
5156,nottheonion,MapleStoryPSN,heraldmailmedia.com,"Brooklyn rapper rhymes he cannot die in the streets, gunned down in the streets.",2,1,1590358005
5157,nottheonion,Letsdoporntogether,celebritynetworth.com,Poor Little Rich Girl Wants Her Assets Unfrozen So She Can Live Like A Billionaire Again,4,1,1590357774
5158,nottheonion,Da_Mad_Jester,thehill.com,South Korea soccer club apologizes after using sex dolls as stand-in fans at empty stadium,2,1,1590357756
5159,nottheonion,WorkHardPlayLittle,latimes.com,Times Investigation: He was a Hollywood darling for fighting dog meat trade. Butchers say he staged killings; he denies it,1,1,1590355882
5160,nottheonion,ricekrispiesrgood,bellingcat.com,Military And Intelligence Personnel Can Be Tracked With The Untappd Beer App,3,1,1590354776
5161,nottheonion,ricekrispiesrgood,news.yahoo.com,Researchers Use a Beer App To Track the Military and CIA,2,1,1590353476
5162,nottheonion,Plainchant,nbcnews.com,COVID-19 is costing drug cartels millions of dollars,211,1,1590353276
5163,nottheonion,bdailyherald,globalnews.ca,Huge owl hatches chicks outside man’s window — now the brood watches TV with him,0,1,1590352595
5164,nottheonion,Kam_yee,kfor.com,Metro elementary drive-thru graduation interrupted with explicit sign from angry neighbor,3,1,1590352104
5165,nottheonion,Futurama_Nerd,nytimes.com,A Feud in Wolf-Kink Erotica Raises a Deep Legal Question,2,1,1590351900
5166,nottheonion,Raymennow,idahoreporter.com,National retailer Tuesday Morning preparing for a potential bankruptcy on Tuesday morning,3,1,1590351650
5167,nottheonion,BobSponge22,thehill.com,"Florida man who spit, coughed on police officers after claiming to have the coronavirus indicted on federal terrorism charges",2,1,1590349182
5168,nottheonion,One_Day_Dead,globalnews.ca,Huge owl hatches chicks outside man’s window — now the brood watches TV with him,343,1,1590346220
5169,nottheonion,el_peaa,bebawy1.blogspot.com,Mineral cosmetics,2,1,1590345275
5170,nottheonion,Surgeon_Mindy,bbc.com,Man sentenced to death in Singapore via Zoom,2,1,1590343860
5171,nottheonion,1970251510,twitter.com,#มีกษัตริย์ไว้ทำไม,3,1,1590343810
5172,nottheonion,21summerroses,livescience.com,Chaco Canyon's famous 'tree of life' might have just been a bench,2,1,1590343291
5173,nottheonion,21summerroses,google.com,Chaco Canyon's famous 'tree of life' might have just been a bench,2,1,1590343094
5174,nottheonion,emitremmus27,nme.com,‘It’s Always Sunny In Philadelphia’ to address coronavirus crisis in next season,2,1,1590342543
5175,nottheonion,CEOofLiberalism,independent.co.uk,"EARTH’S MAGNETIC FIELD IS MYSTERIOUSLY WEAKENING, CAUSING SATELLITES AND SPACECRAFT TO MALFUNCTION",2,1,1590341658
5176,nottheonion,SteevDayv,bangordailynews.com,Man starts wildfire with dropped joint...,0,1,1590341121
5177,nottheonion,llama03ky,independent.co.uk,"Trump heads to golf course as US coronavirus death toll nears 100,000",2,1,1590340823
5178,nottheonion,CEOofLiberalism,google.com,"EARTH’S MAGNETIC FIELD IS MYSTERIOUSLY WEAKENING, CAUSING SATELLITES AND SPACECRAFT TO MALFUNCTION",3,1,1590340754
5179,nottheonion,Ilglsp1,axios.com,"Trump again brings up conspiracy theory Joe Scarborough killed aide; demands investigators use ""forensic geniuses""",1,1,1590340222
5180,nottheonion,Ilglsp1,axios.com,https://www.axios.com/trump-joe-scarborough-murder-conspiracy-6cdde64f-6738-4168-87a9-6a52fb8bb691.html,0,1,1590339902
5181,nottheonion,rlanicek,lifesitenews.com,Transaging man leaves family to live as a six-year-old girl,2,1,1590339475
5182,nottheonion,Ilglsp1,axios.com,"Trump again brings up conspiracy theory Joe Scarborough killed aide; Demands investigators use ""Forensic Geniuses""",0,1,1590339362
5183,nottheonion,Ilglsp1,axios.com,"Trump again brings up conspiracy theory Joe Scarborough killed aide; Demands investigators use ""Forensic Geniuses""",0,1,1590339055
5184,nottheonion,The9thBitYT,businessinsider.com,"More than 40% of Republicans think Bill Gates will use a COVID-19 vaccine to implant a location-tracking microchip in recipients, according to survey",2,1,1590338622
5185,nottheonion,Ilglsp1,axios.com,"TRUMP AGAIN BRINGS UP CONSPIRACY THEORY JOE SCARBOROUGH KILLED AIDE; DEMANDS INVESTIGATORS ""USE FORENSIC GENIUSES """,2,1,1590338589
5186,nottheonion,Ilglsp1,dailymail.co.uk,"TRUMP AGAIN BRINGS UP CONSPIRACY THEORY JOE SCARBOROUGH KILLED AID; DEMANDS INVESTIGATORS ""USE FORENSIC GENIUSES """,2,1,1590338359
5187,nottheonion,ContentParking,twitter.com,"13,000 cardboard cut-out fans were placed in the stadium of Gladback’s first COVID soccer match",2,1,1590338346
5188,nottheonion,WillOfTheLand,aljazeera.com,Women crushed to death in Sri Lanka stampede for $8 handout,1,1,1590337851
5189,nottheonion,RandomNumber99,news.sky.com,Coronavirus 'disappearing' so fast Oxford vaccine has 'only 50% chance of working',4,1,1590336917
5190,nottheonion,jddbeyondthesky,independent.co.uk,Trump says it's 'badge of honour' for US to lead world in coronavirus cases,2,1,1590336676
5191,nottheonion,RandomNumber99,apple.news,Coronavirus 'disappearing' so fast Oxford vaccine has 'only 50% chance of working' — Sky News,2,1,1590334596
5192,nottheonion,gilamasan_reddit,ign.com,PS5: Sony Could Ask You for Pictures of Your Ears to Provide Better Audio,2,1,1590334165
5193,nottheonion,zenpotato,news18.com,"Delhi Man Shoots Self in Ear After Argument, Bullet Pierces His Head &amp; Hits 7-Month Pregnant Wife",5,1,1590332925
5194,nottheonion,1970251510,youtu.be,#มีกษัตริย์ไว้ทำไม,2,1,1590332712
5195,nottheonion,szekeres81,news.sky.com,Adolf Hitler's 'pet' alligator Saturn dies in Moscow Zoo,4,1,1590331427
5196,nottheonion,emitremmus27,theguardian.com,North Dakota governor on brink of tears as he decries ‘mask shaming’,0,1,1590330909
5197,nottheonion,Starlifter4,beaconjournal.com,"Undercover agents enforcing state health rules at restaurants, bars",9,1,1590330857
5198,nottheonion,Starlifter4,cincinnati.com,"Undercover agents enforcing state health rules at restaurants, bars",1,1,1590329957
5199,nottheonion,Deroni76,huffpost.com,Man Sentenced To Death In Singapore Via Zoom Call Amid Pandemic,1,1,1590329816
5200,nottheonion,1970251510,youtu.be,#มีกษัตริย์ไว้ทำไม,2,1,1590329618
5201,nottheonion,Starlifter4,msn.com,"Undercover agents enforcing state health rules at restaurants, bars",2,1,1590329027
5202,nottheonion,tlumacz,the-race.com,"Abt disqualified, fined for imposter plot in virtual FE race",1,1,1590327899
5203,nottheonion,DontDoDrugs316,hindustantimes.com,"Man shoots self in ear, bullet comes out of his head and hits his wife - gurugram",280,1,1590327264
5204,nottheonion,elch3w,7news.com.au,Therapists are using TikTok to help you get through the pandemic,3,1,1590326352
5205,nottheonion,Carnalvore86,clickondetroit.com,"Michigan man plans to steal helicopter for hospital attack to free COVID-19 patients, police say",1,1,1590324770
5206,nottheonion,mikedudical,seattletimes.com,"With restaurants closed, CDC warns of increasingly aggressive rodents looking for new food sources",1,1,1590324160
5207,nottheonion,Voiceamerica,breakingwide.com,Michigan AG Ban Donald Trump From Her State For Not Wearing Mask,0,1,1590323476
5208,nottheonion,-fucknuckle-,news.com.au,Hitlers pet dies. See ya later alligator.,3,1,1590321979
5209,nottheonion,ogg27,people.com,sorry if its a repost,1,1,1590321670
5210,nottheonion,polopiko,mothership.sg,"S'pore boy, 9, cries tears of joy upon eating McNuggets again after 3 weeks of closure",1,1,1590321217
5211,nottheonion,BenderDeLorean,mentalfloss.com,Canadian Man Named Lorne Grabher Stripped of His Right to Have a ‘GRABHER’ License Plate Is Appealing the Court’s Decision,0,1,1590320795
5212,nottheonion,blacktothebird,miamiherald.com,"Beware of ‘aggressive’ rats on the hunt for food during coronavirus pandemic, CDC says",2,1,1590319705
5213,nottheonion,duskrusk,metro.co.uk,Nurse reprimanded for wearing bikini under transparent PPE,2,1,1590318457
5214,nottheonion,Coh_,mothership.sg,"S'pore boy, 9, cries tears of joy upon eating McNuggets again after 3 weeks of closure",2,1,1590318152
5215,nottheonion,Missburr,thedrum.com,PETA protests in-game because they don't like Animal Crossing's treatment of virtual animals.,1,1,1590318095
5216,nottheonion,Kingflares,nydailynews.com,Alligator once thought to have been owned by Hitler dead at 84,0,1,1590316204
5217,nottheonion,dougrayd,marketwatch.com,"Lion, bat and pangolin off the menu as Chinese city of Wuhan bans consumption of wild animals",19,1,1590315260
5218,nottheonion,rainburger,news.com.au,Hitler's pet alligator dies in Moscow zoo.,5,1,1590315113
5219,nottheonion,6666James66,twitter.com,Several Mosques in Turkis city hacked to play an Italian song at the same time,1,1,1590313102
5220,nottheonion,BirdyFeets,cnet.com,"More than 40% of Republicans think Bill Gates will use COVID-19 vaccine to implant microchips, survey says",1,1,1590312673
5221,nottheonion,MCFrozy,open.spotify.com,18 year old rapper from CA check it out!! Spotify link below,1,1,1590311391
5222,nottheonion,WillOfTheLand,abc.net.au,US Navy tests laser weapon it says can destroy aircraft mid-flight,6,1,1590310485
5223,nottheonion,sslloooww,theguardian.com,UK scientists want to infect volunteers with Covid-19 in race to find vaccine,6,1,1590310156
5224,nottheonion,Nergaal,theguardian.com,Puzzled man solving 'miracle' sudoku becomes YouTube sensation,4,1,1590304489
5225,nottheonion,Jeff_Strongmann,google.com,Singapore sentences man to death via Zoom call,1,1,1590301993
5226,nottheonion,Jeff_Strongmann,m.huffpost.com,Man Sentenced To Death In Singapore Via Zoom Call Amid Pandemic,1,1,1590301896
5227,nottheonion,malakd33,10daily.com.au,IKEA Asks Customers Not To Masturbate In Its Stores,23,1,1590298160
5228,nottheonion,kratatatz,journalnow.com,4000 people gathered at a race today in NC,1,1,1590298138
5229,nottheonion,Sorceress683,yahoo.com,California heat will melt mountain snow and kill anyone stupid enough to jump into floodwaters. (California),1,1,1590297809
5230,nottheonion,malakd33,10daily.com.au,IKEA asks customers not to masturbate in its stores.,2,1,1590297719
5231,nottheonion,rabpo,postofasia.com,‘Hitler’s favourite alligator’ dies at Moscow Zoo aged 84,63,1,1590295544
5232,nottheonion,BenjaminCisco,guardian.co.tt,Monkey found in hospital operating theatre,4,1,1590295418
5233,nottheonion,rabpo,rt.com,‘Hitler’s favorite alligator’ dies at Moscow Zoo aged 84,2,1,1590294253
5234,nottheonion,bdailyherald,cleveland19.com,"Homeowners association in California confiscates graduation yard signs, upsetting kids and parents",10,1,1590292122
5235,nottheonion,SillyCubensis,vice.com,"No Evil Foods, a Faux Leftist Vegan-Meat Company, Busts Union Drive - VICE",1,1,1590290310
5236,nottheonion,so_u_sa,armytimes.com,Army denies soldier’s request to grow beard in observance of Flying Spaghetti Monster religion,2335,1,1590290121
5237,nottheonion,Orome2,wxyz.com,"20-year-old beating suspect was moved to nursing home because he has COVID-19, says father",7,1,1590289034
5238,nottheonion,DoremusJessup,cj.my,Three penguins get private tour at art museum,6,1,1590288875
5239,nottheonion,SchoolOnSunday,worldnewsdailyreport.com,"San Francisco police interrupts sex party involving midgets, emus and a fountain of sperm, 71 arrests",2,1,1590288111
5240,nottheonion,fishmasteruniverse,aljazeera.com,Sudan to establish police force to protect healthcare workers,1,1,1590285280
5241,nottheonion,d-101,nytimes.com,A Feud in Wolf-Kink Erotica Raises a Deep Legal Question,2,1,1590285197
5242,nottheonion,dtlv5813,keprtv.com,"Company makes 'Inslee is Non Essential' shirts, proceeds go to small businesses",4,1,1590283560
5243,nottheonion,specialsunflower1,albanyherald.com,"Grandmother must delete Facebook pictures posted online without permission, court rules",1,1,1590282338
5244,nottheonion,specialsunflower1,cnn.com,"Grandmother must delete Facebook pictures posted online without permission, court rules",0,1,1590282102
5245,nottheonion,Denalin,nytimes.com,A Feud in Wolf-Kink Erotica Raises a Deep Legal Question,2,1,1590281637
5246,nottheonion,partyzrfunny,go.newsfusion.com,"Penguin poop creates a buttload of laughing gas, researchers find",1,1,1590281446
5247,nottheonion,Deiomo,news4sanantonio.com,"Penis face mask sales save Utah non-profit, founder says",11,1,1590281138
5248,nottheonion,CapitalCourse,thewestnews.com,Virginia Family Praised for Their Honesty After Finding and Returning Bags Containing $1M in Cash,12,1,1590280953
5249,nottheonion,Deiomo,news4sanantonio.com,"Penis face mask saves Utah non-profit, founder says",1,1,1590280776
5250,nottheonion,Deiomo,google.com,"Penis face mask sales save Utah non-profit, founder says",2,1,1590280641
5251,nottheonion,nthensome,nypost.com,Bolivian orchestra stuck at German castle surrounded by wolves,2,1,1590279696
5252,nottheonion,woodendog24,cinemablend.com,Hot dog!,2,1,1590278563
5253,nottheonion,robynmadseniwp,pokerab.com,PokerAB | Agen IDN Poker Online Indonesia Terpercaya | Bandar Ceme,0,1,1590277649
5254,nottheonion,CarlGerhardBusch,cnn.com,"With restaurants closed, rat sightings are increasing across the United States",5,1,1590277186
5255,nottheonion,mulutavcocktail,mintpressnews.com,Senate Approves $38 Billion for Israel Amid Historic Economic Downturn,1,1,1590276798
5256,nottheonion,Mikeavelli,nytimes.com,A Feud in Wolf-Kink Erotica Raises a Deep Legal Question,2,1,1590276084
5257,nottheonion,aclectasis,complex.com,Pastor who claimed he cured Coronavirus from faith dies from illness,2,1,1590275589
5258,nottheonion,WillOfTheLand,ecns.cn,"China condemns 'gross interference' by UK, Australia and Canada over HKSAR",7,1,1590274978
5259,nottheonion,0utcazt,huzlers.com,"Man Kills Friend For Not Saying ""No Homo"" After 10 Hour Anal Session",2,1,1590274749
5260,nottheonion,JustStatedTheObvious,thehill.com,Trump campaign to fly 'Keep America Great' banners over US beaches on Memorial Day,4,1,1590274485
5261,nottheonion,ploflo,bbc.com,Berlin WW2 bombing survivor Saturn the alligator dies in Moscow Zoo,0,1,1590273415
5262,nottheonion,tefunka,nbcwashington.com,Calif. Design Firm Working on Protective Suit for Concerts and Clubbing,1,1,1590271817
5263,nottheonion,kavinay,arstechnica.com,"Penguin poop creates a buttload of laughing gas, researchers find",10,1,1590270543
5264,nottheonion,the-player-of-games,cnet.com,"More than 40% of Republicans think Bill Gates will use COVID-19 vaccine to implant microchips, survey says",25,1,1590270508
5265,nottheonion,BillWarlow,wrestlinginc.com,"Triple H: ""There was a Casket Match and they filled the casket up with cucumbers just so that when the first time you knock Taker down, you go to roll him into the casket, the top opens up and he looks inside, it's all full of cucumbers. Just, lose his mind.""",0,1,1590270042
5266,nottheonion,ziggygersh,vtcng.com,Grenades Found at Senior Home,1,1,1590269768
5267,nottheonion,snowmaninheat,npr.org,Fear Of Public Restrooms Prompts Creative Solutions As Some Businesses Reopen,0,1,1590268793
5268,nottheonion,StcStasi,time.com,"'Could It Work as a Cure? Maybe.' A Herbal Remedy for Coronavirus Is a Hit in Africa, But Experts Have Their Doubts",10,1,1590267871
5269,nottheonion,ecksdee123420,nytimes.com,A Feud in Wolf-Kink Erotica Raises a Deep Legal Question,2,1,1590267667
5270,nottheonion,DONTthinkTWICE2286,wivb.com,Two faced cat born in Oregon,3,1,1590266697
5271,nottheonion,Maelarion,nytimes.com,A Feud in Wolf-Kink Erotica Raises a Deep Legal Question,2,1,1590266433
5272,nottheonion,captainchriiis,google.com,N.B.A. in Talks to Resume Season at Walt Disney World Resort,2,1,1590265512
5273,nottheonion,Al-Andalusia,theguardian.com,North Dakota governor on brink of tears as he decries ‘mask shaming’,0,1,1590265270
5274,nottheonion,GeorgeOnee,growcola.com,A marijuana plant spotted growing in Argentina stadium as matches stopped due to COVID-19,42,1,1590265206
5275,nottheonion,Al-Andalusia,nbcnews.com,GOP governor in North Dakota gives emotional plea against 'mask shaming',0,1,1590265189
5276,nottheonion,khan_1311,theosnews.xyz,World leaders express grief on the loss of lifes in plane crash,0,1,1590265132
5277,nottheonion,AZN_RISING,people.com,"Ark. Woman Befriended Mom's Killer, Then He Murdered Her",2,1,1590264272
5278,nottheonion,shutupandtakemyfunny,nbcnews.com,Virginia high school banner groups students of color to make dark outline of logo,1,1,1590264231
5279,nottheonion,shutupandtakemyfunny,washingtonpost.com,A banner segregated graduating seniors by color. White administrators didn’t notice.,2,1,1590264143
5280,nottheonion,shutupandtakemyfunny,dailymail.co.uk,Virginia principal apologizes for 'racist' graduation banner that used black students' faces as shading for the outline of high school logo,2,1,1590264050
5281,nottheonion,hildebrand_rarity,usatoday.com,"Twins' Class AA team, Pensacola Blue Wahoos, list stadium on Airbnb for $1,500 per night",0,1,1590264031
5282,nottheonion,MikeyBot3000,telegraph.co.uk,People going blind as they are 'too scared' to see a doctor or optician,2,1,1590264018
5283,nottheonion,FreshFranks,businessinsider.com,"More than 40% of Republicans think Bill Gates will use a COVID-19 vaccine to implant a location-tracking microchip in recipients, according to survey",2,1,1590263848
5284,nottheonion,sestero,cinemablend.com,Michael Bublé was once fired from the set of The X-Files for stealing a hotdog from craft services,2,1,1590263553
5285,nottheonion,TakeYoFaceOff,independent.co.uk,George Osborne claims he danced with ‘normal-sized’ Jennifer Lawrence at Oscars after-party,2,1,1590263443
5286,nottheonion,Thisisbhusha,timesofindia.indiatimes.com,"Bhopal: Burglar trim pubic hair, masturbates and robs four shops at Gurukripa Complex in Kolar",2,1,1590263007
5287,nottheonion,Voiceamerica,breakingwide.com,Bill Gates Philanthropism Turned Into Coronavirus Conspiracy Theories,5,1,1590260286
5288,nottheonion,jab116,kxan.com,Neighbor upset by noise during drive-thru graduation places sign in yard: ‘Shut the “F” up’,4,1,1590259947
5289,nottheonion,OnlyLiterature,ladbible.com,75-Foot Elon,2,1,1590259879
5290,nottheonion,memesareokiguess,independent.co.uk,Tulsa unveils giant statue of Elon Musk to try and lure Tesla to the area,2,1,1590259008
5291,nottheonion,memesareokiguess,mashable.com,"A 75-foot-tall Elon Musk statue now towers over Tulsa, Oklahoma",2,1,1590258932
5292,nottheonion,Infernalism,cnn.com,Public health officials in Ohio apologize for asking minorities to avoid 'gang symbolism' on face masks,20,1,1590258918
5293,nottheonion,HadjiChippoSafri,skysports.com,NBA in talks to play rest of season at Disney World,3,1,1590258887
5294,nottheonion,Infernalism,herald-dispatch.com,Ohio county apologizes for ‘offensive’ guide urging minorities to avoid ‘gang symbolism’ on masks,2,1,1590258797
5295,nottheonion,mahsan64,daily-news-and-nafees-sceneries.blogspot.com,"Eid-ul-Fitr 2020: Shawwal moon located, Eid Will be tomorrow",2,1,1590258519
5296,nottheonion,Infernalism,washingtonpost.com,Ohio county apologizes for ‘offensive’ guide urging minorities to avoid ‘gang symbolism’ on masks,1,1,1590258420
5297,nottheonion,Infernalism,businessinsider.com.au,Ohio public health officials apologised after releasing mask guidance for African Americans to avoid wearing face coverings with 'gang symbolism',2,1,1590258339
5298,nottheonion,Infernalism,independent.co.uk,US health officials apologise for telling black Americans to avoid 'gang symbolism' on face masks,2,1,1590258185
5299,nottheonion,squeakim,google.com,"Businesses around the country refuse service to people wearing masks. Instead, encourage hugs.",2,1,1590257834
5300,nottheonion,Heyitsmeagainduh,youtu.be,Man teaches homeless to code... because that will help them out alot!,2,1,1590257644
5301,nottheonion,Mal5341,yahoo.com,"GOP Senate campaign says candidate isn't a follower of QAnon, while candidate compares QAnon to Jesus.",2,1,1590256860
5302,nottheonion,Obey_Night_Owls,cnet.com,"More than 40% of Republicans think Bill Gates will use COVID-19 vaccine to implant microchips, survey says",1197,1,1590255250
5303,nottheonion,Ideclareathumbwar123,mol.im,FDA approves new women's birth control gel that was 86% effective in trials,4,1,1590255201
5304,nottheonion,Obey_Night_Owls,rollingstone.com,"Half of Fox News Viewers Believe Bill Gates Wants to Use Virus Vaccines to Track You, New Poll Says",2,1,1590254965
5305,nottheonion,Obey_Night_Owls,wonkette.com,Half Of All Fox Viewers Think Bill Gates Wants To Use COVID-19 Vaccine To Implant Microchips In Them,2,1,1590254744
5306,nottheonion,BurnedRope,bbc.co.uk,"""Hitlers"" alligator &amp; Berlin bombing survivor, Saturn dies",0,1,1590254687
5307,nottheonion,Dr_Decibel,unilad.co.uk,Death Angel Drummer Will Carroll Rethinks Relationship With Satan After Nearly Dying From Coronavirus,2,1,1590254399
5308,nottheonion,taiiigastyle,rawstory.com,Welp.,2,1,1590254256
