,subreddit,author,domain,title,num_comments,score,timestamp
3398,nottheonion,sharyndavies,tvnz.co.nz,"Countries around the world could learn from NZ's social bubble strategy, research shows",2,1,1591155664
3399,nottheonion,Tropius2,abc15.com,Phoenix police arrest dozens with copy-and-paste evidence,5,1,1591154315
3400,nottheonion,footballrocc,benjerrys.co,Ben &amp; Jerry’s call for a dismantling of white supremacy,45,1,1591153994
3401,nottheonion,TheXXVth,theintercept.com,"Minneapolis Police Union President: “I’ve Been Involved in Three Shootings Myself, and Not a One of Them Has Bothered Me”",2,1,1591153207
3402,nottheonion,Whyrobotslie,twitter.com,NYPD to wear black bands around their badge numbers to help mourn for the 27 brothers lost to covid 19,2,1,1591152636
3403,nottheonion,Remove_your_pants,pedestrian.tv,NSW’s Top Cop Says The Officer Who Bodyslammed An Indigenous Teen Was Just Having “A Bad Day”,365,1,1591151864
3404,nottheonion,LicencetoKrill,npr.org,Senate Republicans Set Summer Of Investigations Involving Biden,6,1,1591150749
3405,nottheonion,LicencetoKrill,npr.org,Senate Republicans to Begin Investigations Involving Joe Biden,0,1,1591150651
3406,nottheonion,Ezzy17,lawandcrime.com,Nebraska Governor Called African Americans ‘You People’ During Meeting About Racism,5,1,1591150397
3407,nottheonion,stupidstupidreddit2,foxnews.com,Pat Robertson criticizes Trump's comment about governors looking like 'jerks': 'It isn't cool',1,1,1591149860
3408,nottheonion,Ezzy17,washingtonpost.com,"Use of medical helicopters to target protesters a ‘foolish’ violation of norms, experts say",2,1,1591148908
3409,nottheonion,jonnyinternet,mercurynews.com,"Richmond man caught cannibalizing his grandmother, police say",2,1,1591147910
3410,nottheonion,WillOfTheLand,cnn.com,Brazil's former president calls for Bolsonaro to be impeached,3,1,1591147819
3411,nottheonion,Remove_your_pants,nationalreview.com,Gun Control -- Joe Biden: Cops Should be Trained to Shoot Attackers in the Leg,2,1,1591147503
3412,nottheonion,Remove_your_pants,complex.com,Joe Biden Suggests Police Aim at Legs of Assailants Instead of Hearts to Decrease Fatal Shootings,2,1,1591147443
3413,nottheonion,Remove_your_pants,news.yahoo.com,Biden Proposes Training Cops to Shoot Attackers in the Leg to Reduce Fatalities,2,1,1591147328
3414,nottheonion,mydogclimbstree,timesfreepress.com,Tennessee governor halts distribution of free COVID-19 masks over concerns for pesticide exposure,2,1,1591145870
3415,nottheonion,yourspacelawyer,independent.co.uk,Chechen leader accused of mass torture and murder tells Trump to 'end the mayhem',2,1,1591145722
3416,nottheonion,stuart2202,aljazeera.com,Iran calls on US to 'stop violence' against its own people,2,1,1591144937
3417,nottheonion,kay_bizzle,mlive.com,"Man accused of stabbing brother’s goat, charged with felony",6,1,1591144070
3418,nottheonion,TC1851,blackenterprise.com,"BLACK LOUISVILLE RESTAURANT OWNER WHO PROVIDED COPS WITH FREE MEALS KILLED BY POLICE, POLICE CHIEF FIRED",2,1,1591143858
3419,nottheonion,keeppanicking,montsame.mn,Mongolia to provide USD 1 million to help United States fight coronavirus,4,3,1591140897
3420,nottheonion,slipperysoup,reporter.am,"NYPD Scanner Broadcasts Calls to Shoot, Run Over Protesters",159,5,1591140382
3421,nottheonion,slipperysoup,tmz.com,"NYPD Scanner Broadcasts Calls to Shoot, Run Over Protesters",2,1,1591140182
3422,nottheonion,slipperysoup,google.ca,"NYPD Scanner Broadcasts Calls to Shoot, Run Over Protesters",2,1,1591140115
3423,nottheonion,Tullius19,news.sky.com,Coronavirus 'disappearing' so fast Oxford vaccine has 'only 50% chance of working' | UK News,7,3,1591140087
3424,nottheonion,sssigma,eastbaytimes.com,"Richmond man caught cannibalizing his grandmother, police say",12,3,1591139766
3425,nottheonion,[deleted],sfchronicle.com,"Richmond man caught cannibalizing 90-year-old grandmother, police say",2,1,1591139677
3426,nottheonion,One_Day_Dead,wcax.com,Man faces assault charge for hitting VTrans worker with pickle,3,4,1591139589
3427,nottheonion,[deleted],mercurynews.com,"Richmond man caught cannibalizing his grandmother, police say",2,1,1591139382
3428,nottheonion,[deleted],thenations.co.uk,Wuhan doctor whose skin changed color from coronavirus treatment dies after battling disease for five months,0,3,1591139276
3429,nottheonion,snowflame92,militarytimes.com,"Nazi headstones will be removed from US veterans cemeteries, VA leaders say",46,2,1591139220
3430,nottheonion,roosoh,ndtv.com,Pregnant Elephant Fed Pineapple Stuffed With Firecrackers In Kerala. She Died Standing In River,16,2,1591138771
3431,nottheonion,bfpor2-illuminati,foxnews.com,Yale grad students' 'hunger strike' apparently involves eating when hungry,23,2,1591136719
3432,nottheonion,WhereWhatTea,washingtonpost.com,Police mistake nationwide protests as demanding more brutality,2,1,1591136718
3433,nottheonion,bfpor2-illuminati,freebeacon.com,Yale Grad Students Go on ‘Symbolic’ Hunger Strike Where They’re Allowed to Eat,2,1,1591136607
3434,nottheonion,jigsawmap,ohiocapitaljournal.com,GOP Rep. on anti-racism resolution: I'm 'darker’ than most black lawmakers,0,1,1591136305
3435,nottheonion,[deleted],theintercept.com,"Minneapolis Police Union President: “I’ve Been Involved in Three Shootings Myself, and Not a One of Them Has Bothered Me”",2,1,1591135916
3436,nottheonion,Blauwelt,live5news.com,"Man hired hitman, who hired hitman, who hired hitman, who hired hitman, who hired hitman, who snitched",5,4,1591135328
3437,nottheonion,Laminatrix2,washingtonpost.com,Hakutulokset Tulokset internetistä Police mistake nationwide protests as demanding more brutality,2,1,1591134440
3438,nottheonion,spozeicandothis,buzzfeednews.com,A lot of celebrities are being useless right now,2,1,1591133572
3439,nottheonion,Nergaal,who.int,New Ebola outbreak detected in northwest Democratic Republic of the Congo; WHO surge team supporting the response,3,2,1591132362
3440,nottheonion,pjbrof,whdh.com,"Police: Mass. man threw ‘large pickle’ out car window, struck state worker on side of road",38,5,1591132319
3441,nottheonion,[deleted],newsweek.com,"FBI Asks for Evidence of Individuals Inciting Violence During Protests, People Respond With Videos of Police Violence",2,1,1591131357
3442,nottheonion,plaidkingaerys,thehill.com,McConnell on Trump's response to protests: 'I'm not going to critique other people's performances',1,1,1591130749
3443,nottheonion,bringeroftherain,dailymail.co.uk,George Floyd's criminal record,2,1,1591130127
3444,nottheonion,NoLiesMostly,fivethirtyeight.com,De-escalation Keeps Protesters And Police Safer. Departments Respond With Force Anyway.,2,1,1591129082
3445,nottheonion,skiliar13,cbsnews.com,"Twitter says fake ""Antifa"" account was run by white supremacists",327,4,1591128813
3446,nottheonion,[deleted],pcgamer.com,"Ubisoft says Trackmania is not subscription-based, you just pay for it multiple times",2,1,1591128725
3447,nottheonion,Zhana-Aul,thehill.com,Trump claims he has done more for black community than any president since Lincoln,1,1,1591128281
3448,nottheonion,[deleted],thenations.co.uk,Three British teenagers who mocked George Floyd's death in online video are arrested on suspicion of committing hate crime,6,3,1591127978
3449,nottheonion,emitremmus27,newsweek.com,"FBI Asks for Evidence of Individuals Inciting Violence During Protests, People Respond With Videos of Police Violence",2,1,1591127461
3450,nottheonion,SillyCubensis,tmz.com,"L.A. Cops Encourage White Lady Tagging Building, Tell Her to Spell 'Floyd'",2,1,1591127087
3451,nottheonion,[deleted],irishmirror.ie,"Couples 'should wear masks while having sex' amid coronavirus pandemic, experts advise",2,1,1591126971
3452,nottheonion,masiakasaurus,metro.co.uk,Black restaurant owner who gave police free meals shot dead by cops,2,1,1591126011
3453,nottheonion,MillionsOfAnts,thepitchkc.com,Seminar on training police to kill without hesitation coming to Kansas City this December,893,6,1591125988
3454,nottheonion,[deleted],newsweek.com,"FBI Asks for Evidence of Individuals Inciting Violence During Protests, People Respond With Videos of Police Violence",2,1,1591125661
3455,nottheonion,Foxhound220,wjtv.com,Madison County prosecutor: ‘We can only hope the deadly coronavirus strain spreads in riots’,27,13,1591125048
3456,nottheonion,Cryptochitis,video.foxnews.com,"Trump needs to become ""the race president"" according to fox news.",2,1,1591124082
3457,nottheonion,Voiceamerica,breakingwide.com,"California Woman Screams At looters “Please Stop, You’re Going To Get Trump Re-elected With That”",2,1,1591123236
3458,nottheonion,CigaretteNightmares,live5news.com,"Man hired hitman, who hired hitman, who hired hitman, who hired hitman, who hired hitman, who snitched",5,5,1591122241
3459,nottheonion,Ekomiko,religionnews.com,Positively Negative. Goodly Bad.,0,4,1591122213
3460,nottheonion,FoxQT,nbcphiladelphia.com,Man Dies Trying to Blow Up ATM on Philadelphia Sidewalk,15,9,1591121842
3461,nottheonion,Heytobtob2,news.sky.com,Drunk driver killed man in crash then returned to pub,1,4,1591121233
3462,nottheonion,sayluv,dateway.net,Buzzkill: Man Threatened To Unleash ‘Riot Control Bees’ If Protest Became Riot,50,14,1591120748
3463,nottheonion,jayraider77,aljazeera.com,Iran calls on US to ’stop violence’ against its own people,5,10,1591120696
3464,nottheonion,[deleted],forbes.com,Apple Warns Looters With Stolen iPhones: You Are Being Tracked,2,1,1591120343
3465,nottheonion,immewnity,thenational.scot,Downing Street to end weekend briefings because of low ratings,0,7,1591120190
3466,nottheonion,16coxk,vice.com,K-Pop Fans Took Down a Police Snitching App. The Dallas Police app was taken down after K-pop accounts encouraged fans to flood its submissions with idol videos and memes.,1,1,1591119902
3467,nottheonion,immewnity,huffingtonpost.co.uk,Weekend No.10 Coronavirus Press Conferences To End Because Of Low TV Ratings,1,1,1591119685
3468,nottheonion,[deleted],politico.eu,MEP takes part in debate in his underwear,1,1,1591119598
3469,nottheonion,Ih8usernam3s,youtube.com,"Trump to law enforcement: ""Don't be too nice"" during arrests",1,1,1591118771
3470,nottheonion,1970251510,youtu.be,#มีกษัตริย์ไว้ทำไม,2,1,1591118629
3471,nottheonion,Quibble_,m.huffpost.com,Police Chief Blames Looters for George Floyd's Death,1,1,1591118573
3472,nottheonion,nazibomba,axios.com,Twitter suspends fake antifa account tied to white nationalists,5,9,1591118187
3473,nottheonion,LTsidewalk,dailymail.co.uk,Pregnant elephant killed in India ate firecracker in pineapple,1,1,1591117809
3474,nottheonion,kraven420,newindianexpress.com,Pineapple filled with firecrackers killed pregnant wild elephant,4,3,1591117300
3475,nottheonion,spiceprincesszen,reddit.com,WTF George Floyd Challenge,0,1,1591116348
3476,nottheonion,nrvrckr,cbsnews.com,"Police chief says he doesn't ""believe racism plays a role"" in NYPD, as protesters fill streets",23,0,1591116214
3477,nottheonion,HighFivePuddy,pedestrian.tv,J.K. Rowling Apologises After Tweeting At A Child About Fucking Up Some TERFs,2,4,1591116206
3478,nottheonion,[deleted],nytimes.com,Protesters Dispersed With Tear Gas So Trump Could Pose at Church,1,1,1591116165
3479,nottheonion,Amirkerr,m.dw.com,India returns alleged spy bird to pakistan,2,3,1591116025
3480,nottheonion,[deleted],independent.co.uk,JK Rowling ‘mortified’ after accidentally tweeting ‘f*** up some TERFs’ in response to a 9-year-old’s drawing,1,1,1591116005
3481,nottheonion,AgentSquishy,nyti.ms,"Facing Protests Over Use of Force, Police Respond With More Force",1,1,1591115986
3482,nottheonion,notfair1234,chaser.com.au,Iraq launches invasion to bring democracy to America,1,0,1591115757
3483,nottheonion,gorgeousredhead,bbc.com,Tiger King zoo handed to rival Carole Baskin,4,7,1591115718
3484,nottheonion,FakeRolex000,youtu.be,Guy tempts cops with a DONUT during riots,1,1,1591115658
3485,nottheonion,Organic_Extent,youtu.be,US Police arrest South Sudanese man no knowing he is actually and FBI agent,1,1,1591115624
3486,nottheonion,unbeast,cbsnews.com,"Police chief says he doesn't ""believe racism plays a role"" in NYPD, as protesters fill streets",80,9,1591115169
3487,nottheonion,lando_staffy,nytimes.com,President Trump prompted outrage after peaceful protestors were dispersed with tear gas so he could pose for photos at a church.,1,1,1591114396
3488,nottheonion,ninjasonic102,fox5sandiego.com,Use of force criticized in protests about police brutality,0,8,1591114375
3489,nottheonion,notthatpatrick,dw.com,Over 100 officers were dispatched in the German capital after a protest to raise support for Berlin's club and rave scene turned into its own techno party,6,6,1591114204
3490,nottheonion,Jeremy_Alberts,news18.com,"Austria to 'Neutralise' Adolf Hitler's Birthplace with Redesign, Turn it into Police Station",2,8,1591114129
3491,nottheonion,MartialBob,eastbaytimes.com,"Richmond man caught cannibalizing a relative, police say",3,4,1591114047
3492,nottheonion,piotrek2302,leaderlive.co.uk,House where Adolf Hitler was born to become a police station,33,10,1591114016
3493,nottheonion,KingSimmons,nbcphiladelphia.com,Man Dies Trying to Blow Up ATM on Philadelphia Sidewalk,2,8,1591113988
3494,nottheonion,[deleted],nytimes.com,Austria Presents Design Turning Hitler's Birthplace Into Police Station,1,1,1591113839
3495,nottheonion,CtrlAltWhiskey,sports.yahoo.com,Biden suggests police could shoot assailants 'in the leg instead of the heart',1,1,1591113724
3496,nottheonion,theflyz,aljazeera.com,Iran calls on US to 'stop violence' against its own people,11,17,1591113269
3497,nottheonion,DillonTheKid,nationalreview.com,Gun Control -- Joe Biden: Cops Should be Trained to Shoot Attackers in the Leg,1,1,1591112716
3498,nottheonion,nazibomba,axios.com,Antifa_US twitter account were actually white nationalist impersonating as Antifa,28,42,1591112691
3499,nottheonion,DillonTheKid,sports.yahoo.com,Biden Proposes Training Cops to Shoot Attackers in the Leg to Reduce Fatalities,1,1,1591112472
3500,nottheonion,1970251510,twitter.com,#มีกษัตริย์ไว้ทำไม,2,1,1591112455
3501,nottheonion,1970251510,twitter.com,#มีกษัตริย์ไว้ทำไม,2,1,1591111643
3502,nottheonion,1970251510,twitter.com,#มีกษัตริย์ไว้ทำไม,2,1,1591111024
3503,nottheonion,sayluv,dateway.net,Man Threatened To Unleash ‘Riot Control Bees’ If Protest Became Riot,28,27,1591110106
3504,nottheonion,sayluv,infowars.com,Man Threatened To Unleash ‘Riot Control Bees’ If Protest Became Riot,1,1,1591110067
3505,nottheonion,unclerudy,breitbart.com,Having Sex With Someone You Don’t Already Live With Now Illegal In Britain Under Coronavirus Laws,1,1,1591110060
3506,nottheonion,Kbdiggity,religionnews.com,Priest among those tear-gassed so Trump could take a picture in front of a church,1,1,1591109313
3507,nottheonion,[deleted],talkingpointsmemo.com,Cops Break Up Peaceful Protest With Tear Gas So Trump Can Have A Church Photo-Op,1,1,1591109181
3508,nottheonion,Majorxerocom,wreg.com,"Man arrested, tells police he’s exercising his ‘freedom of rights to break into the Sam’s Club’",3,11,1591108883
3509,nottheonion,esporx,wusa9.com,LAPD chief: I 'misspoke' saying looters just as responsible for George Floyd death as police,18,37,1591107530
3510,nottheonion,esporx,yahoo.com,"LAPD Chief Michel Moore Says George Floyd’s Death Is On Looters’ Hands “As Much As” Officers’, Then Says He Misspoke",1,1,1591107418
3511,nottheonion,esporx,deadline.com,LAPD Chief: George Floyd Death On Looters’ Hands “As Much As” Officers’,1,1,1591107345
3512,nottheonion,hypetoyz,cbc.ca,"""Start by changing your team name"". Provincial MP's response to CFL team Edmonton Eskimos' post on racism.",2,1,1591107292
3513,nottheonion,ZombieBisque,forbes.com,Millionaire Author John Grisham Says Not All Men Who Watch Child Porn Are Pedophiles,1,1,1591107120
3514,nottheonion,jomtienislife,abc7ny.com,2 officers hurt when SUV plows through police in Buffalo,5,2,1591106268
3515,nottheonion,[deleted],vulture.com,Kpop fans flood Dallas Police app with fancams,1,1,1591105997
3516,nottheonion,[deleted],dallasnews.com,Kpop fans flood Dallas Police app with fancams,1,1,1591105579
3517,nottheonion,jkon731,forbes.com,Millionaire Author John Grisham Says Not All Men Who Watch Child Porn Are Pedophiles,1,1,1591105085
3518,nottheonion,A_Cool_Eel,thatcricketblog.wordpress.com,"Steven Hawking: Mayans miscalculated by 8 years, 2020 is actual end of civilisation",1,1,1591105074
3519,nottheonion,A_Cool_Eel,google.com,"teven Hawking: Mayans miscalculated by 8 years, 2020 is actual end of civilisation",2,1,1591104963
3520,nottheonion,dbrank,breakingthenews.net,Pompeo laments ban on Tiananmen vigil in HK,11,1,1591103830
3521,nottheonion,Bdub76,cnn.com,What nudists do during a lockdown,2,1,1591103673
3522,nottheonion,Boneyg001,aljazeera.com,Iran calls on US to 'stop violence' against its own people,18,1,1591103596
3523,nottheonion,dbrank,thedailybeast.com,"Amongst U.S. Crackdown, Pompeo Will Meet With Tiananmen Survivors",0,1,1591103301
3524,nottheonion,omgburritos,aljazeera.com,Iran calls on US to 'stop violence' against its own people,0,1,1591102385
3525,nottheonion,Twingamer25,aljazeera.com,Iran calls on US to 'stop violence' against its own people,17,1,1591101507
3526,nottheonion,ulltraveling,thedetrend.com,Madly : Trump suggests ‘injection’ of disinfectant to beat coronavirus,0,1,1591101460
3527,nottheonion,rdfv7,reddit.com,LAPD show up to a store that requested help against looters and immediately put the black store owners in handcuffs,0,1,1591101414
3528,nottheonion,CaptainBroverdose,theplaylist.net,‘Avatar 2’ Actor David Thewlis Has “No Idea” What The Film Will Look Like But Knows He’s “A Blue Thing”,10,1,1591100909
3529,nottheonion,mamiwater,breakingwide.com,Mayor De Blasio: Am Proud Of My Daughter After She Was Arrested During Manhattan Protest,11,1,1591100846
3530,nottheonion,Sporeboss,mothership.sg,Sheng Siong staff quietly contributes S$200 to funeral money box on instruction of management,3,1,1591100260
3531,nottheonion,DogStrangler,theatlantic.com,America Has No President,3,1,1591100156
3532,nottheonion,DogStrangler,google.com,America Has No President,1,1,1591100075
3533,nottheonion,NoOrchid2,cnn.com,"Iran criticizes ""oppressive"" US reaction to protests",1370,1,1591099417
3534,nottheonion,JinpingThePoo,yahoo.com,Biden suggests police could shoot assailants 'in the leg instead of the heart',1,1,1591098179
3535,nottheonion,1970251510,youtu.be,#มีกษัตริย์ไว้ทำไม,2,1,1591098040
3536,nottheonion,Vaioreviews,my1tb.com,Finally Got the Fastest 1TB USB in the world,0,1,1591097267
3537,nottheonion,Complete_Equipment,vice.com,Let’s not forget the President’s direct ties to white supremacy. This man has targeted minorities from the start.,1,1,1591096854
3538,nottheonion,Dan_Lacount,bbc.com,Ebola outbreak 2020: Why di virus dey always come back,1,1,1591095996
3539,nottheonion,ralphbernardo,freepressjournal.in,‘He’s holding the Bible upside down’: Trump called out for church photo op amid George Floyd protests,1,1,1591095436
3540,nottheonion,frsmtc,channelnewsasia.com,"Facebook: “Freedom of expression is a fundamental human right, and we work hard to protect and defend this important civil liberty around the world”",1,1,1591094621
3541,nottheonion,imtiredlol89,newsweek.com,Countries Criticize U.S. for Human Rights Abuses After George Floyd Killing,1,1,1591094053
3542,nottheonion,YayMayonnaise,pcgamer.com,"Ubisoft says Trackmania is not subscription-based, you just pay for it multiple times",2,1,1591093272
3543,nottheonion,filmicsite,thefauxy.com,Protestors who looted puma showroom come to return shoes as they were not comfortable,5,1,1591092613
3544,nottheonion,havrancik,youtube.com,Police patrolling neighborhood and shooting civilians on their own property,2,1,1591092521
3545,nottheonion,hitssquad,taiwanenglishnews.com,Man Rides Around Taiwan Naked to Promote Legalization of Nudity,0,1,1591091515
3546,nottheonion,rangertommyoliver,dailymail.co.uk,Invasion of mutant blood-sucking ticks hits Russia,1,1,1591091480
3547,nottheonion,nugaseya,upi.com,Donald Rumsfeld on looting and freedom,1,1,1591091120
3548,nottheonion,TizzioCaio,udayavani.com,"Colombia: Amid rising Covid-19 cases, Company develops hospital bed that converts into coffin",4,1,1591090676
3549,nottheonion,hitssquad,taiwanenglishnews.com,Man Rides Around Taiwan Naked to Promote Legalization of Nudity [Taiwan English News],1,1,1591090293
3550,nottheonion,WillOfTheLand,montreal.ctvnews.ca,Legault calls on Quebecers to fight racism but denies existence of systemic racism in Quebec,1,1,1591090026
3551,nottheonion,CuddlesWithSatan,pcgamer.com,"Ubisoft says Trackmania is not subscription-based, you just pay for it multiple times.",1,1,1591089564
3552,nottheonion,makemestaymurph,change.org,Finally a cause we can all get behind,1,1,1591088737
3553,nottheonion,elch3w,abc.net.au,I thought my family and I could still travel to Italy as coronavirus took hold. I was wrong,2,1,1591088191
3554,nottheonion,Smith_421,nbcnews.com,Wife of accused ex-Minneapolis police officer Derek Chauvin says in divorce filing she wants to change her name,42,1,1591085458
3555,nottheonion,rogue_master17,itechpost.com,[VIDEO] Hillarious Moment Ride Operator Pranks Couple By Telling Them They Could Fall Off The Ride,0,1,1591085364
3556,nottheonion,OliverMarkusMalloy,cnn.com,Carole Baskin awarded the zoo once owned by 'Tiger King' Joe Exotic,1,1,1591085164
3557,nottheonion,Dasovietbear,reddit.com,Police come to scene of a robber and arrest the shop owners,0,1,1591085048
3558,nottheonion,ahm713,presstv.com,Saudi official destroys TV during charity video game contest,0,1,1591084700
3559,nottheonion,grpagrati,edition.cnn.com,Carole Baskin awarded the zoo once owned by 'Tiger King' Joe Exotic,11,1,1591084623
3560,nottheonion,grpagrati,people.com,Tiger King - Carole Baskin Granted Control of Joe Exotic's Former Zoo,1,1,1591084539
3561,nottheonion,DropDoc,megaphone.upworthy.com,Monkeys in India attacked a lab assistant and ran off with COVID-19 samples,1,1,1591084386
3562,nottheonion,Rofocal07,rferl.org,Russian Police Colonel Being Treated For COVID-19 Falls From Moscow Hospital Window,16,1,1591084193
3563,nottheonion,SaddledTiger,kstp.com,Minneapolis Police Union President Wants Jobs Back for 4 Officers Fired in George Floyd Murder,3,1,1591083940
3564,nottheonion,SaddledTiger,google.com,Minneapolis Police Union President Wants Jobs Back for the 4 Officers Fired in George Floyd Murder,2,1,1591083855
3565,nottheonion,Smith_421,wjtv.com,Madison County prosecutor: ‘We can only hope the deadly coronavirus strain spreads in riots’,1,1,1591083851
3566,nottheonion,amystarr,sfgate.com,Trump Tear Gasses Peaceful Protesters to Get Photo Op at Church,1,1,1591083666
3567,nottheonion,wakandaa_foreva,nenow.in,"World awaits deadlier pandemic from chicken than COVID-19, fears it could kill half the world's population : Scientist",0,1,1591083621
3568,nottheonion,amystarr,people.com,Trump Tear Gasses Peaceful Protesters To Clear Path for Photo Op at Church,2,1,1591083557
3569,nottheonion,DionStabber,pcgamer.com,"Ubisoft says Trackmania is not subscription-based, you just pay for it multiple times",1,1,1591083097
3570,nottheonion,amystarr,buzzfeednews.com,Trump Tear Gasses Peaceful Protestors To Get Photo Op At Church,1,1,1591082444
3571,nottheonion,amystarr,google.com,Trump Tear Gasses Peaceful Protestors For Photo Op At Church,0,1,1591082272
3572,nottheonion,amystarr,nytimes.com,How is this not the onion?,1,1,1591081943
3573,nottheonion,S3ZDNUD3S,aljazeera.com,Iran calls on US to 'stop violence' against its own people,61,1,1591081909
3574,nottheonion,salvds,vanityfair.com,"Man who spent the weekend in a bunker demands ""weak"" governors ""dominate"" protesters",2,1,1591081175
3575,nottheonion,MathTheState,news.yahoo.com,Biden Proposes Training Cops to Shoot Attackers in the Leg to Reduce Fatalities,2,1,1591080903
3576,nottheonion,One_Day_Dead,accuweather.com,Zombie fires erupt in Arctic,7,1,1591078842
3577,nottheonion,MournBlad3,hollywoodreporter.com,Damn You Carole Baskins,1,1,1591078722
3578,nottheonion,mostaksaif,apnews.com,Trump as thug or hero? Depends on what network you watch,1,1,1591078603
3579,nottheonion,Ricks_Liver,wjtv.com,Madison County prosecutor: ‘We can only hope the deadly coronavirus strain spreads in riots’,109,1,1591078109
3580,nottheonion,Ricks_Liver,google.com,Madison County prosecutor: ‘We can only hope the deadly coronavirus strain spreads in riots’,2,1,1591077970
3581,nottheonion,Tallowpot,bbc.com,If this is actually happening?,1,1,1591077712
3582,nottheonion,a_crystal_mun,dallasnews.com,Dallas police app back up after K-pop fans organized to flood it with videos,2,1,1591076497
3583,nottheonion,zkynaston,complex.com,Joe Biden Suggests Police Aim at Legs of Assailants Instead of Hearts to Decrease Fatal Shootings,2,1,1591075389
3584,nottheonion,erstwhile99,businessinsider.com,"Los Angeles police detain group defending store on live television, while would-be burglars flee",2,1,1591074842
3585,nottheonion,rogue_master17,itechpost.com,[VIDEO] Hillarious Moment Ride Operator Pranks Couple By Telling Them They Could Fall Off The Ride,0,1,1591074552
3586,nottheonion,WorkTomorrow,apnews.com,"Police fire tear gas, deploy flash bangs to disperse peaceful protest near White House ahead of Trump speech",0,1,1591073155
3587,nottheonion,WorkTomorrow,buzzfeednews.com,Peaceful Protesters Were Gassed Outside The White House So Trump Could Get A Photo Op At A Church,2,1,1591073015
3588,nottheonion,1970251510,youtu.be,#มีกษัตริย์ไว้ทำไม,3,1,1591072613
