,subreddit,author,domain,title,num_comments,score,timestamp
0,nottheonion,DaFunkJunkie,businessinsider.com,"Trump says that 'if we stop testing right now, we'd have very few cases' of coronavirus",1,1,1592254366
1,nottheonion,user98710,rte.ie,Garden ornaments found to be WWII artillery rounds,0,1,1592254247
2,nottheonion,therealchappy24,thehill.com,"Trump on coronavirus: 'If we stop testing right now, we'd have very few cases, if any'",0,1,1592254237
3,nottheonion,TheKekStreetJoural,edinburghlive.co.uk,Edinburgh Zoo in row with Scots gangster over the sale of giant gorilla heads,0,1,1592254233
4,nottheonion,[deleted],businessinsider.com.au,"Trump says that 'if we stop testing right now, we'd have very few cases' of coronavirus",1,1,1592254225
5,nottheonion,ertgsdgf,bitchute.com,Other Voices,0,1,1592254011
6,nottheonion,therealchappy24,google.com,"Trump on coronavirus: 'If we stop testing right now, we'd have very few cases, if any'",1,1,1592254003
7,nottheonion,[deleted],newsweek.com,Ted Cruz's College Roommate Says Texas Senator Has Been 'Pathetic Since 1988',1,0,1592253800
8,nottheonion,ohnoh18,nymag.com,Ted Cruz Challenges 70-Year-Old Actor to Wrestling Match (Against Someone Else),1,1,1592253257
9,nottheonion,kingfiasco,nymag.com,Ted Cruz Challenges 70-Year-Old Actor to Wrestling Match (Against Someone Else),1,1,1592253049
10,nottheonion,tankistHistorian,bbc.com,Polish leader likens LGBT 'ideology' to communism,1,0,1592252921
11,nottheonion,shershah_,theguardian.com,Facebook blocks and bans users for sharing Guardian article showing Aboriginal men in chains,1,3,1592252096
12,nottheonion,tunablepizza,cinemablend.com,Arrow Star Stephen Amell Accuses Neighbor Of Pooping On His Roof,1,1,1592251960
13,nottheonion,phord,independent.co.uk,Trump dismisses uptick in coronavirus cases and suggests a 'stop' to testing,1,1,1592251443
14,nottheonion,shershah_,dw.com,Berlin authorities placed children with pedophiles for 30 years,0,4,1592251267
15,nottheonion,shershah_,theguardian.com,Only three out of 53 countries say US has handled coronavirus better than China,2,4,1592251155
16,nottheonion,NumberNumb,boston.cbslocal.com,6 eBay Employees Charged With Sending Bloody Pig Mask To Natick Couple,0,3,1592250921
17,nottheonion,shershah_,theguardian.com,"Facebook blocks and bans users for sharing Guardian article showing Aboriginal men in chains Social media site incorrectly removed historical photo on grounds of nudity, then for three days blocked and even banned users who posted link to article",1,4,1592250884
18,nottheonion,[deleted],vice.com,"A New Coronavirus Outbreak in Beijing Just Forced the City Back Into Lockdown: Just like six months ago, the outbreak is linked to a market, and some officials are trying to downplay the seriousness of the situation.",1,1,1592250816
19,nottheonion,ash1794,reuters.com,Somali sea gangs lure investors at pirate lair - Reuters,0,4,1592250789
20,nottheonion,[deleted],bloomberg.com,"China warms to idea of four more years of Trump presidency, believes that erosion of American influence outweighs damage from disputes",4,1,1592250607
21,nottheonion,muaytao,nbcnews.com,Top eBay employees harassing a blogger,1,0,1592250407
22,nottheonion,[deleted],theverge.com,Top eBay employees harassing and threatening a blogger,2,1,1592250065
23,nottheonion,Tommy__Douglas,vice.com,"Fox News Has Officially Lost Its Mind Over the Autonomous Zone in Seattle The network has run altered and mislabeled photos of the commune-like CHAZ, and an anchor apparently never saw ""Monty Python",2,1,1592249887
24,nottheonion,[deleted],chicagotribune.com,Gov. Rauner drinks chocolate milk to demonstrate his commitment to diversity,2,1,1592248977
25,nottheonion,Stonewalled89,indiewire.com,"Ron Perlman Challenges Ted Cruz to $50,000 Fight in Support of Black Lives Matter",0,1,1592247080
26,nottheonion,reWindTheFrog,bbc.co.uk,Man jailed for urinating at PC Keith Palmer memorial during protest,4,4,1592247051
27,nottheonion,[deleted],thehill.com,Ted Cruz challenges actor Ron Perlman to wrestle Jim Jordan after attack on Gaetz,0,1,1592246585
28,nottheonion,dervishingalot,nbcnews.com,"Biden is far less unpopular than Hillary Clinton was four years ago, polling shows",0,1,1592246316
29,nottheonion,progressiveforbiden,forklog.media,"Social Media Posts Can Get You Arrested, Now in the U.S.",2,0,1592245840
30,nottheonion,[deleted],bbc.co.uk,Right wing football fan attends counter protest in London to protect statues. Gets arrested for urinating on memorial to murdered police officer.,6,4,1592245792
31,nottheonion,kicksjoysharkness,reddit.com,Supreme Court rules workers can’t be fired for being gay or transgender,0,1,1592244231
32,nottheonion,didismom,nbcboston.com,"Former eBay Employees Sent Cockroaches, Bloody Pig Mask to Mass. Couple in Harassment Campaign",2,2,1592243980
33,nottheonion,deplorableadorable,thevintagenews.com,Hobby Lobby Returns Stolen Treasure ‘Gilgamesh Dream Tablet’ to Iraq,30,11,1592243756
34,nottheonion,dreasgrech,bbc.com,GitHub abandons 'master' and 'slave' terms to avoid row,14,3,1592243608
35,nottheonion,[deleted],nbcboston.com,"Former Ebay executives terrorized couple by sending them items such as bloody pig mask, and a box of live cockroaches",2,3,1592243444
36,nottheonion,dreasgrech,bbc.com,"GitHub to replace ""master"" and ""whitelist"" with alternative terms to avoid slavery references",9,1,1592243252
37,nottheonion,WillOfTheLand,zdnet.com,South African bank to replace 12m cards after employees stole master key,0,6,1592243128
38,nottheonion,TacticalGaius,thehill.com,Ted Cruz challenges actor Ron Perlman to wrestle Jim Jordan after attack on Gaetz,0,1,1592243083
39,nottheonion,PepeGambino,cnet.com,"No, KFC isn't releasing a new games console",2,1,1592242947
40,nottheonion,oneyearandaday,vice.com,Border Patrol Bought Dirtbikes With Money Budgeted for Medicine,3,1,1592242778
41,nottheonion,Alexander0232,theguardian.com,Fox News host talks race by calling out the real enemy: Sesame Street's Elmo,9,9,1592242677
42,nottheonion,[deleted],forbes.com,‘Fox News’ Host Tucker Carlson Gets Triggered By ‘Sesame Street’s’ Elmo,2,1,1592242630
43,nottheonion,[deleted],deccanchronicle.com,"No kidding: Train runs without driver for 13 km, rail staff chases it on bike",0,1,1592242521
44,nottheonion,[deleted],salon.com,"John Oliver calls ""racist"" Fox News host Tucker Carlson a ""f**king moron” after he attacks Elmo",2,1,1592242514
45,nottheonion,MattW224,cnn.com,Barbra Streisand gifts George Floyd's daughter Disney shares,10,7,1592242448
46,nottheonion,[deleted],dailydot.com,Supreme Court rulings remind people we can have good news in 2020,2,1,1592242432
47,nottheonion,OldHockeyTrick69,freep.com,All-new Ford Bronco debut July 9 falls on O.J. Simpson's birthday,71,24,1592242150
48,nottheonion,dataguy45,google.com,Spongebob Squarepants Gay?,1,1,1592241874
49,nottheonion,Dear_Jurisprudence,npr.org,NASCAR Team Debuts 'Blue Lives Matter' Car To Show Support For Law Enforcement,8,2,1592241717
50,nottheonion,TravelingRob,metro.co.uk,Man with horse and cart furious after being refused service at KFC drive-thru,1,1,1592241391
51,nottheonion,[deleted],m.thewire.in,Wtf,2,1,1592241363
52,nottheonion,[deleted],npr.org,NASCAR Team Debuts 'Blue Lives Matter' Car To Show Support For Law Enforcement,1,1,1592241187
53,nottheonion,Space_Pirate_Roberts,kikiotolu.com,"“To be a tenant is a sin. When you have a landlord, you have two Lords” – Nigerian Pastor says",6,4,1592241119
54,nottheonion,3138Kevin,9news.com,"Roofing company workers forced onto ground, held at gunpoint by man who thought they were Antifa",21,8,1592240548
55,nottheonion,insipidwanker,komonews.com,Welcome to 'Exploding Whale Memorial Park' on the Oregon coast!,0,4,1592239989
56,nottheonion,[deleted],cnbc.com,Hertz says it expects stockholders to lose all their money in filing for selling more stock,1,2,1592239836
57,nottheonion,lilcash650,thestar.com.my,Chinese farmer unleashes 300 million hungry cockroaches to eat food waste,1,1,1592239401
58,nottheonion,spookyjaboc,abc3340.com,Dolly Parton statue may replace KKK leader monument at the Tennessee capitol,0,1,1592239271
59,nottheonion,twig_and_berries_,usnews.com,Trump Supporters Burn Michigan Absentee Ballot Applications,1,1,1592239202
60,nottheonion,twio_b95,foxnews.com,"Ted Cruz challenges Ron Perlman to wrestle Jim Jordan, 'Hellboy' actor wants Cruz instead",0,1,1592239121
61,nottheonion,[deleted],thehill.com,Ted Cruz challenges actor Ron Perlman to wrestle Jim Jordan after attack on Gaetz,0,1,1592238914
62,nottheonion,I_am_not_hon_jawley,newsweek.com,Ron Perlman Wants to Wrestle Ted Cruz For Black Lives Matter,1,1,1592238028
63,nottheonion,[deleted],deadline.com,Fox News Confuses Monty Python Line Quoted By Reddit With Seattle CHAZ Report,1,1,1592237988
64,nottheonion,AGI_69,msn.com,GitHub is dropping coding terms like 'master' and 'slave',1,1,1592237802
65,nottheonion,I_am_not_hon_jawley,nypost.com,'Hellboy' actor Ron Perlman challenges Ted Cruz to wrestling match,1,1,1592237655
66,nottheonion,[deleted],narcity.com,Calgary Gelato Company Is Sorry For ‘Ignorant’ Black Lives Matter Flavour,0,1,1592237575
67,nottheonion,MrZackarius,zdnet.com,"GitHub to replace ""master"" with alternative term to avoid slavery references",3,0,1592237479
68,nottheonion,twig_and_berries_,clickondetroit.com,Trump supporters burn Michigan absentee ballot applications,1,1,1592237415
69,nottheonion,ploflo,fool.com,67% of Jobless Workers Get More in Unemployment Than They Earned,236,24,1592237040
70,nottheonion,twig_and_berries_,amp.detroitnews.com,Trump supporters are burning their absentee ballot applications,1,1,1592236941
71,nottheonion,twig_and_berries_,google.com,Trump supporters burn their own absentee ballot applications,1,1,1592236820
72,nottheonion,KaptainKeywork,telegraph.co.uk,"Workers can't be fired for being gay or transgender, Supreme Court says in landmark ruling.",1,1,1592236651
73,nottheonion,unabletoprocess,tribuneindia.com,"Kolkata man orders copy of 'Communist Manifesto' online, gets 'Bhagavad Gita' instead",1,3,1592236544
74,nottheonion,KaptainKeywork,bloomberg.com,Workers can't be fired for being gay; US Supreme Court rules.,1,1,1592236453
75,nottheonion,jigsawmap,theguardian.com,"Hellboy actor Ron Perlman challenges Ted Cruz to $50,000 charity wrestling bout",1,1,1592236441
76,nottheonion,EldritchMalediction,concordia.ca,3 Concordia researchers collaborate to engage Indigenous knowledges in the study of physics,2,2,1592236230
77,nottheonion,CallumVH,cnbc.com,Supreme Court rules workers can't be fired for being gay or transgender,1,4,1592236164
78,nottheonion,tfiggs,thehill.com,Ted Cruz challenges actor Ron Perlman to wrestle Jim Jordan after attack on Gaetz,2,1,1592235989
79,nottheonion,First__Consul,google.com,Two officers given probation for raping a woman while she was handcuffed in a van. The law was changed to make it illegal for officers to rape people in custody.,1,1,1592235674
80,nottheonion,sbr_then_beer,kikiotolu.com,"“To be a tenant is a sin. When you have a landlord, you have two Lords” – Nigerian Pastor says",1,1,1592235646
81,nottheonion,[deleted],thehill.com,Ted Cruz challenges actor Ron Perlman to wrestle Jim Jordan after attack on Gaetz,1,1,1592235580
82,nottheonion,[deleted],foxnews.com,"Ted Cruz challenges Ron Perlman to wrestle Jim Jordan, 'Hellboy' actor wants Cruz instead",1,1,1592235253
83,nottheonion,Rivaldough,time.com,"Two Former New York Detectives Avoid Jail, Given Probation For Sex With Teen They Held In Custody",2,1,1592235226
84,nottheonion,[deleted],heavy.com,Senator Ted Cruz Bets $10K on Rep. Jim Jordan Beating Up ‘Hellboy’ Ron Perlman in a wrestling match,1,1,1592235201
85,nottheonion,Hobbescrownest,happymag.tv,NYC Health is recommending using glory holes in latest pandemic sex advice,1,2,1592235165
86,nottheonion,[deleted],thehill.com,Ted Cruz challenges actor Ron Perlman to wrestle Jim Jordan after attack on Gaetz,0,1,1592235130
87,nottheonion,[deleted],washingtonpost.com,Sen. Ted Cruz wants to settle Twitter feud with wrestling match between actor Ron Perlman and Rep. Jim Jordan,1,1,1592235051
88,nottheonion,[deleted],time.com,Two officers given probation for raping a woman while she was handcuffed in a van. The law was changed to make it illegal for officers to rape people in custody.,1,3,1592235026
89,nottheonion,jimmyrey,lockportjournal.com,Burglars have the meats after Arby’s theft,15,10,1592234977
90,nottheonion,[deleted],time.com,"Two Former New York Detectives Avoid Jail, Given Probation For Sex With Teen They Held In Custody",0,1,1592234950
91,nottheonion,jmcmuffin22,msn.com,Trump says he’ll cut off funding to states that make it easier to vote,1,1,1592234480
92,nottheonion,red_man_dan,cnbc.com,Hertz says it expects stockholders to lose all their money in filing for selling more stock,5,5,1592234245
93,nottheonion,bandicootbutt,washingtonpost.com,Sen. Ted Cruz wants to settle Twitter feud with wrestling match between actor Ron Perlman and Rep. Jim Jordan,1,1,1592233874
94,nottheonion,ctylanbui,youtube.com,"Cổng xếp tự động , cổng xếp inox lắp tại ủy ban Q12- Cty Lan Bùi",1,1,1592233270
95,nottheonion,PeacefullyInsane,newsweek.com,Ted Cruz's College Roommate Says Texas Senator Has Been 'Pathetic Since 1988',1,1,1592232936
96,nottheonion,ak47rocks1337yt,winnipeg.ctvnews.ca,"Suspect forgets keys at crime scene, apprehended when he returns",1,3,1592232809
97,nottheonion,[deleted],indiewire.com,"Ron Perlman Challenges Ted Cruz to $50,000 Fight in Support of Black Lives Matter",0,1,1592232801
98,nottheonion,ak47rocks1337yt,winnipeg.ctvnews.ca,"Suspect forgets keys at crime scene, apprehended when he returns",1,1,1592232779
99,nottheonion,[deleted],foxnews.com,"Ted Cruz challenges Ron Perlman to wrestle Jim Jordan, 'Hellboy' actor wants Cruz instead",0,1,1592232776
100,nottheonion,[deleted],amp.usatoday.com,"Secret Service for Trump Jr.'s Mongolia trip to hunt rare sheep cost $76,000, watchdog says",0,1,1592232061
101,nottheonion,[deleted],forbes.com,"Donald Trump Jr.’s Hunting Trip To Kill Endangered Sheep In Mongolia Cost Taxpayers More Than $75,000",1,1,1592231999
102,nottheonion,h3xadecimal2,jare.cloud,AIs from AI Dungeon 2 to sexy to funny and one based wholly on Reddit!,1,0,1592230981
103,nottheonion,thindenimguy,bbc.co.uk,Poland 'invades' Czech Republic in 'misunderstanding',2,3,1592230852
104,nottheonion,[deleted],easttexasmatters.com,Sen. Ted Cruz challenges actor Ron Perlman to wrestling match after Twitter feud,0,1,1592230339
105,nottheonion,[deleted],washingtonpost.com,Sen. Ted Cruz wants to settle Twitter feud with wrestling match between actor Ron Perlman and Rep. Jim Jordan,1,1,1592230281
106,nottheonion,kazt_,google.com,Poland invades Czech Republic by accident,1,0,1592229949
107,nottheonion,FlickAndSnorty,facebook.com,Fox news quotes Monty python when reporting about the autonomous zone,2,1,1592229404
108,nottheonion,cp_87,winnipeg.ctvnews.ca,"Suspect forgets keys at crime scene, apprehended when he returns",2,1,1592229186
109,nottheonion,ShinigamiDady,metro.co.uk,Boris tries to show shopping is safe by visiting empty shopping centre Read more: https://metro.co.uk/2020/06/14/boris-tries-show-shopping-safe-visiting-empty-shopping-centre-12850910/?fbclid=IwAR3Sg3jL9dB6z2u0caJj558FYkcNwMZBAfYJ06sJgulA84BE2ETq0cNcGFI?ito=cbshare Twitter: https://twitter.com/Me,1,1,1592229013
110,nottheonion,trinerr,limerickpost.ie,Council calls halt to unsung heroes' riverbank cleanup because they're affecting wildlife living in the rubbish.,2,1,1592228198
111,nottheonion,DrAnthonyFauci,hk.news.appledaily.com,Wages for Chinese trolls drop 60%,16,1,1592227139
112,nottheonion,DackieTackie,theguardian.com,Covid-19 expert Karl Friston: ‘Germany may have more immunological “dark matter”’,0,1,1592226982
113,nottheonion,progressiveforbiden,time.com,San Francisco Man Confronted by White Couple After Writing 'Black Lives Matter' Outside His House,0,1,1592226593
114,nottheonion,1970251510,youtu.be,#FREEDOM#DEMOCRACY#FUTURE#HOPE#STAND WITH DEMOCRACY#STAND FOR HUMAN RIGHTS#STAND UP PEOPLE,1,1,1592226553
115,nottheonion,SeanFrancisco28,abc3340.com,Please let this happen.,1,1,1592225521
116,nottheonion,sarahN69,mazainside.com,"Hero BLM supporter carried white far-right protester whose life was in danger, as he declares 'it's not black v white, it is everyone versus racists'",0,1,1592225217
117,nottheonion,laaldit,indiatoday.in,Kolkata man orders Communist Manifesto. Amazon delivers Bhagavad Gita,0,1,1592223769
118,nottheonion,DrAnthonyFauci,abcnews.go.com,Father and son who beat up and stabbed 12-year-old boy together arrested,5,1,1592222016
119,nottheonion,Dimkovskii,world-news365.net,Legend transport driver heads over to battle mugger assaulting old lady,0,1,1592221264
120,nottheonion,DackieTackie,theguardian.com,Covid-19 expert suggests that dark matter may provide immunity against coronavirus,1,1,1592221106
121,nottheonion,ChaseME7,whdh.com,"Veterans protest RI donut shop that ended discounts for police, military",62,1,1592219733
122,nottheonion,BitUnderpr00ved,newsweek.com,White Woman Questions Man Who Wrote 'Black Lives Matter' in Chalk On His Own Property,1,1,1592219248
123,nottheonion,WillOfTheLand,cbc.ca,CEO asks employees to lie on timecards or risk job losses — violating labour laws,220,1,1592218190
124,nottheonion,makid123,world-news365.net,9 Secrets Hiding Behind Famous Logos,0,1,1592217743
125,nottheonion,cate2283,propublica.org,New Trump Appointee to Foreign Aid Agency Has Denounced Liberal Democracy and “Our Homo-Empire”,0,1,1592217538
126,nottheonion,cate2283,independent.co.uk,New Trump appointee suggested America is a 'homo-empire' ruled by the 'tyrannical LGBT agenda',1,1,1592217478
127,nottheonion,cate2283,lgbtqnation.com,Trump’s new White House appointee thinks a ‘homo-empire’ is taking over the world,1,1,1592217286
128,nottheonion,johnruby,hk.news.appledaily.com,Wages for Chinese trolls drop 60%,2,1,1592214794
129,nottheonion,johnruby,hk.news.appledaily.com,Wages for wumaos drop 60%,0,1,1592214781
130,nottheonion,the-player-of-games,theguardian.com,Facebook blocks and bans users for sharing Guardian article showing Aboriginal men in chains,21,1,1592214483
131,nottheonion,iyoiiiu,thehill.com,Philippines journalist known for investigating Duterte convicted of 'cyber libel',7,1,1592214193
132,nottheonion,mamiwater,breakingwide.com,Petitioners want Confederate Statues In Tennessee Replaced With Dolly Parton’s Monuments,26,1,1592214054
133,nottheonion,1970251510,twitter.com,#FREEDOM#DEMOCRACY#FUTURE#HOPE#STAND WITH DEMOCRACY#STAND FOR HUMAN RIGHTS#STAND UP PEOPLE,2,1,1592213074
134,nottheonion,vt8919,carscoops.com,The 2021 Ford Bronco debuts on July 9th... O.J. Simpson's birthday.,1,1,1592213000
135,nottheonion,Chikinuqqet,cinemablend.com,The shit people get up to these days....,2,1,1592212777
136,nottheonion,1970251510,ntd.com,#FREEDOM#DEMOCRACY#FUTURE#HOPE#STAND WITH DEMOCRACY#STAND FOR HUMAN RIGHTS#STAND UP PEOPLE,1,1,1592212515
137,nottheonion,tequilasky,straitstimes.com,Japanese model-actress Nozomi Sasaki apologises for husband's affair,5,1,1592212148
138,nottheonion,1970251510,theepochtimes.com,#FREEDOM#DEMOCRACY#FUTURE#HOPE#STAND WITH DEMOCRACY#STAND FOR HUMAN RIGHTS#STAND UP PEOPLE,1,1,1592211867
139,nottheonion,sanketwashere,deccanchronicle.com,"No kidding: Train runs without driver for 13 km, rail staff chases it on bike",1,1,1592210249
140,nottheonion,Maelarion,nzherald.co.nz,Coronavirus: Petition calls on UK to declare war on New Zealand 'then immediately surrender',63,1,1592209302
141,nottheonion,LateRain1970,newsweek.com,Facebook account copying President Trump's posts word-for-word gets flagged for inciting violence,1,1,1592208146
142,nottheonion,AGI_69,twitter.com,GitHub will no longer use the term 'master' as default branch because of negative association,1,1,1592205808
143,nottheonion,Mufasrod,abc3340.com,Dolly Parton statue may replace KKK leader monument at the Tennessee capitol,0,1,1592204359
144,nottheonion,superl2,telegraph.co.uk,Microsoft-owned coding site Github to replace the term 'master' in push to remove slavery references,1,1,1592203450
145,nottheonion,[deleted],nypost.com,Jewish kids take over Brooklyn streets to demand reopening of sleepaway camps,1,1,1592202687
146,nottheonion,EmperorTweed,usatoday.com,"Fact check: Photo shows Biden with Byrd, who once had ties to KKK but wasn't a grand wizard",0,1,1592202306
147,nottheonion,tugboattomp,foxnews.com,Man in horse-drawn carriage kicked out of KFC drive-thru,1,1,1592202121
148,nottheonion,[deleted],google.com,"Fact check: Photo shows Biden with Byrd, who once had ties to KKK but wasn't a grand wizard",1,1,1592201610
149,nottheonion,ceowin,hk.news.appledaily.com,Wages for Chinese trolls drop 60%,5,4,1592201509
150,nottheonion,toxicmarkets,thedeepdive.ca,US Federal Reserve Now Owns Defaulted Hertz Bonds,2,3,1592200573
151,nottheonion,toxicmarkets,zerohedge.com,The Fed Is Now The Proud Owner Of Bankrupt Hertz Bonds,2,1,1592200354
152,nottheonion,toxicmarkets,wsj.com,Hertz Lenders Brace for Losses From Formerly Triple-A Bonds. Bonds backed by Hertz Global Holdings Inc.’s fleet of rental cars had the same credit rating as the U.S. government just a few weeks ago.,1,1,1592200161
153,nottheonion,DaoFerret,abc3340.com,Dolly Parton statue may replace KKK leader monument at the Tennessee capitol,0,1,1592199859
154,nottheonion,[deleted],telegraph.co.uk,Microsoft-owned coding site Github to replace the term 'master' in push to remove slavery references,1,1,1592199769
155,nottheonion,HobbieK,cbr.com,Stephen Amell's Neighbor Took a Shit On the Arrow Star's Roof,1,1,1592199605
156,nottheonion,MelonSmoothie,zdnet.com,"GitHub to replace ""master"" with alternative term to avoid slavery references",102,14,1592198028
157,nottheonion,MelonSmoothie,zdnet.com,Github removes 'master' and 'slave' from terminology to avoid slavery references,1,1,1592197948
158,nottheonion,sww0705,theguardian.com,JK Rowling recalls 'amazing' moment she met her idol Morrissey,6,0,1592196912
159,nottheonion,_notyep_,cinemablend.com,Arrow Star Stephen Amell Accuses Neighbor Of Pooping On His Roof,1,1,1592195772
160,nottheonion,Row199,cinemablend.com,Is this real life?,1,1,1592195730
161,nottheonion,OfficialOwez,twitter.com,GitHub will no longer use the term 'master' as default branch because of negative association,1,1,1592194777
162,nottheonion,[deleted],abc3340.com,Dolly Parton statue may replace KKK leader monument at the Tennessee capitol,1,1,1592194224
163,nottheonion,Ready_Mouse,theguardian.com,New Zealand government deploys nude 'porn actors' in web safety ad,1331,283,1592193480
164,nottheonion,[deleted],cinemablend.com,Yes this is real,1,1,1592193092
165,nottheonion,AdamNW,nintendosoup.com,Nintendo Says Reselling Animal Crossing: New Horizons Villagers For Money Is Against The Rules,5,21,1592192076
166,nottheonion,bdailyherald,via.q13fox.com,"Man fakes Down Syndrome, dupes caregivers into changing his diapers, Arizona police say",105,736,1592191899
167,nottheonion,DiocletianBlobb,ft.com,The super-rich have a history of doing well out of a global crisis,51,116,1592191139
168,nottheonion,maxiiim2004,time.com,Israel Approves Plans to Build New Settlement in Occupied Golan Heights Named After President Trump,1,1,1592190037
169,nottheonion,[deleted],deadline.com,Fox News Confuses Monty Python Line Quoted By Reddit With Seattle CHAZ Report,1,1,1592189710
170,nottheonion,N7Greenfire,abc3340.com,Dolly Parton statue may replace KKK leader monument at the Tennessee capitol,0,1,1592189600
171,nottheonion,[deleted],independent.co.uk,Fox News falls for Monty Python joke in report criticising Seattle protesters,1,1,1592189517
172,nottheonion,progressiveforbiden,cbs46.com,"$10,000 reward offered for identity of Wendy's arsonist",4,0,1592188804
173,nottheonion,james8475,timesofisrael.com,Protesters shout ‘dirty Jews’ at Paris rally against police racism,2,1,1592188591
174,nottheonion,[deleted],cinemablend.com,Arrow Star Stephen Amell Accuses Neighbor Of Pooping On His Roof,1,1,1592188284
175,nottheonion,rnifnuf,edition.cnn.com,Poland accidentally invaded the Czech Republic last month,32,119,1592187058
176,nottheonion,rnifnuf,edition.cnn.com,Poland accidentally invaded the Czech Republic last month,1,1,1592186905
177,nottheonion,[deleted],time.com,Israel Approves Plans to Build New Settlement in Occupied Golan Heights Named After President Trump.,1,1,1592186700
178,nottheonion,maxiiim2004,time.com,Israel Approves Plans to Build New Settlement in Occupied Golan Heights Named After President Trump.,1,1,1592186667
179,nottheonion,[deleted],twitter.com,GitHub will no longer use the term 'master' as default branch because of negative association,1,1,1592186202
180,nottheonion,[deleted],dailywire.com,Ice Cube Opposes Canceling ‘Paw Patrol’,1,1,1592185308
181,nottheonion,[deleted],washingtonpost.com,Rep. Riggleman ousted in Virginia GOP convention after presiding over same-sex marriage,1,1,1592183846
182,nottheonion,TedTheodoreMcfly,pinknews.co.uk,"Tens of thousands call for Louisiana Confederate statues to be replaced with true American icon, Britney Spears",1,1,1592183778
183,nottheonion,16coxk,reuters.com,"Polish president compares 'LGBT ideology' to Soviet indoctrination. Quote: ""If anyone has any doubts whether (LGBTQ+) is an ideology or not, then check the history how LGBT movement was built."" I'm embarrassed and shocked by this ignorant statement...",1,0,1592183771
184,nottheonion,[deleted],katu.com,Twitter abuzz that Spongebob is gay after Nickelodeon tweet honoring LGBTQ+ community,2,1,1592183545
185,nottheonion,ilikedota5,thenewspaper.com,New Mexico: Motorist Sues After Police Conduct Prostate Exam For Failure To Signal,156,1232,1592183270
186,nottheonion,kaemai0726,usatoday.com,"""We elected Obama""",3,1,1592182417
