,subreddit,author,domain,title,num_comments,score,timestamp
1712,nottheonion,james2296,patch.com,"Providence Donut Shop Ends Police Discount, Providence PD Up In Arms",1,1,1591724986
1713,nottheonion,when-users-rule,independent.co.uk,The Village People order Trump to stop playing 'Macho Man' and 'YMCA' at rallies,1,1,1591724629
1714,nottheonion,HalcyonBurnstride,washingtonpost.com,New bill would prohibit the president from nuking a hurricane,1,1,1591724410
1715,nottheonion,Thecrazyredhead,edition.cnn.com,'Miss Hitler' pageant entrant and her partner jailed for belonging to neo-Nazi group,267,2535,1591724400
1716,nottheonion,[deleted],cnn.com,BabyNames.com makes a powerful statement in honor of the black lives lost to police violence,1,2,1591723730
1717,nottheonion,FumingOstrich35,theguardian.com,"Trump makes baseless claim about man, 75, shoved by police: ‘Could be a set-up?’",1,1,1591723474
1718,nottheonion,[deleted],theguardian.com,Trump Spreads Baseless Conspiracy Theory That Video of Buffalo Cops Pushing Elderly Man Was Antifa 'Set Up',1,1,1591723346
1719,nottheonion,johnthevikingjesus,m.clevescene.com,Cleveland Tourism Bureau Struggles to Build on Mayor Frank Jackson’s ‘Butthole of the World’ Campaign,1,1,1591723229
1720,nottheonion,FumingOstrich35,thedailybeast.com,Trump Spreads Baseless Conspiracy Theory That Video of Buffalo Cops Pushing Elderly Man Was Antifa 'Set Up',1,2,1591723221
1721,nottheonion,Dillionaire,fox9.com,St. Paul police screen 'Zootopia' as part of anti-bias training,97,1315,1591723009
1722,nottheonion,Yetts3030,completemusicupdate.com,Village People ask Donald Trump to stop walking on stage to Macho Man,1,1,1591722363
1723,nottheonion,[deleted],cnn.com,'Miss Hitler' pageant entrant and her partner jailed for belonging to neo-Nazi group,1,1,1591722089
1724,nottheonion,HighBarrister,manchestersfinest.com,This Masked Man is Delivering Free Weed to NHS Staff &amp; Key Workers,2,37,1591721539
1725,nottheonion,[deleted],nbcnews.com,"5-year-old brings cocaine to class, says it makes him 'feel like Spider-Man,' dad arrested",3,3,1591721172
1726,nottheonion,CorRock314,mirror.co.uk,'Miss Hitler' beauty pageant contestant jailed for part in neo-Nazi terror group,1,1,1591720815
1727,nottheonion,[deleted],manchestersfinest.com,This masked man is delivering free weed to healthcare staff and essential workers,2,6,1591720546
1728,nottheonion,Heavy-Addiction,cnbc.com,Apple’s Siri and Google’s Assistant have been updated to express support for Black Lives Matter,0,1,1591720338
1729,nottheonion,Bobby1211,brandeating.com,Burger King Selling Social Distancing Whopper in Italy with Three Times the Onions,9,47,1591719902
1730,nottheonion,iamnotjimmate,amp.cnn.com,Donald Trump's deeply irresponsible conspiracy theory on the Buffalo man injured by police,1,1,1591719807
1731,nottheonion,AnishNoor92,youtube.com,2020 Latest and Unique trouser Design | Cutting and Stitching,1,1,1591719745
1732,nottheonion,voidworship,wivb.com,Trump claims 75-year-old Buffalo protester “could be an ANTIFA provocateur” as man remains hospitalized,1,1,1591719283
1733,nottheonion,[deleted],globalnews.ca,Trump floats unfounded theory that 75-year-old protester pushed by police is Antifa,1,1,1591719249
1734,nottheonion,[deleted],businessinsider.com,Trump accuses 75-year-old Buffalo protester of being with antifa,1,1,1591719148
1735,nottheonion,[deleted],forbes.com,Trump Claims 75-Year-Old Man Shoved By Buffalo Police May Be An Antifa Agitator,1,1,1591719093
1736,nottheonion,BiteYourThumbAtMeSir,nbcnews.com,"In Klamath Falls, Oregon, victory declared over antifa, which never showed up",17,66,1591718797
1737,nottheonion,Tommy__Douglas,video.twimg.com,Watch when Trump made fun of people in choke holds and asked police to use force,1,1,1591718718
1738,nottheonion,1970251510,twitter.com,#SAVEวันเฉลิม#ยกเลิก112#มีกษัตริย์ไว้ทำไม,1,1,1591717863
1739,nottheonion,iamnotjimmate,abcnews.go.com,Trump tweets conspiracy theory about Buffalo protester police officers knocked to ground,1,1,1591717624
1740,nottheonion,[deleted],bbc.co.uk,PG and Yorkshire Tea tell Black Lives Matter critics 'don't buy our tea',0,1,1591717580
1741,nottheonion,knd-numbuh1,marketwatch.com,Russia urges the U.S. to ‘observe democratic standards’ and respect Americans’ right to protest,33,116,1591717392
1742,nottheonion,[deleted],abcnews.go.com,Trump tweets conspiracy theory about Buffalo protester police officers knocked to ground saying he is ANTIFA provocateur,1,1,1591717198
1743,nottheonion,straightouttamalton,theshovel.com.au,NRA Accidentally Forgets To Rise Up Against Tyrannical Government,1,1,1591717040
1744,nottheonion,iamnotjimmate,vice.com,Trump Accuses 75-Year-Old Shoved by Buffalo Police on Video of Faking Fall,1,1,1591716947
1745,nottheonion,[deleted],amp.theguardian.com,Trump claims Buffalo man pushed by police was ‘Antifa provocateur’,0,1,1591716755
1746,nottheonion,Duckitor,thejakartapost.com,'We'll be back': Italy prison escapees promise to return,3,13,1591715754
1747,nottheonion,[deleted],marketwatch.com,Russia urges the U.S. to ‘observe democratic standards’ and respect Americans’ right to protest,1,8,1591715308
1748,nottheonion,johnruby,aljazeera.com,India-China border dispute 'killing thousands of pashmina goats',0,3,1591714364
1749,nottheonion,willow_vanillow,nypost.com,Indian man undergoes surgery after sticking phone charger into penis,1,1,1591713954
1750,nottheonion,CorRock314,newsweek.com,Former Miss Hitler Beauty Pageant Entrant Jailed For Being Part of Neo-Nazi Terrorist Group,1,1,1591713849
1751,nottheonion,CorRock314,newsweek.com,Former Miss Hitler Beauty Pageant Entrant Jailed For Being Part of Neo-Nazi Terrorist Group,1,1,1591713793
1752,nottheonion,jdayellow,richmond-news.com,Mercedes-Benz customer flies from Richmond to Germany - to complain about 'unsafe' car,2,20,1591713702
1753,nottheonion,[deleted],sciencealert.com,Thousands of 'Penis Fish' Have Washed Up on a California Beach,1,1,1591713581
1754,nottheonion,Logical-Belt,thedailyfodder.com,Screw Politics... PORN ACTOR Running For Office In FLORIDA,2,6,1591713332
1755,nottheonion,[deleted],sandiegouniontribune.com,"God has ‘removed’ coronavirus, Tanzania’s president claims",0,1,1591713289
1756,nottheonion,[deleted],washingtonpost.com,"God has ‘removed’ coronavirus, Tanzania’s president claims",1,1,1591713195
1757,nottheonion,[deleted],newsbreakapp.com,Trump claims 75-year-old man shoved by Buffalo police could be part of 'set up',0,1,1591713158
1758,nottheonion,A_Modern_Publicus,independent.co.uk,Trump’s plans to use nuclear weapons on hurricanes challenged in new Democratic bill,1,1,1591712865
1759,nottheonion,Gulo_gulo_1,reuters.com,Russian chefs in naked lockdown protest after virus strips them of income,1,1,1591712607
1760,nottheonion,[deleted],slashfilm.com,The Real Space Force Might Lose Its Trademark to Netflix’s ‘Space Force’,1,1,1591712391
1761,nottheonion,mufk7568,dailymail.co.uk,Miss Hitler beauty pageant contestant who called herself 'The Buchenwald Princess' and tried to recruit 15-year-old schoolgirls for banned far right terror group National Action is jailed for three years alongside her Nazi ex,1,1,1591712326
1762,nottheonion,QueerPoodle,eenews.net,Texas Dem wants to prevent Trump from nuking a hurricane,1,1,1591712128
1763,nottheonion,NoahPransky,foxnews.com,"'Tiger King' Joe Exotic says husband abandoned him, begs Donald Trump, Cardi B and Kim Kardashian for help",1,1,1591712078
1764,nottheonion,Mortambulist,independent.co.uk,The Village People order Trump to stop playing ‘Macho Man’ and ‘YMCA’ at rallies,1,1,1591711824
1765,nottheonion,punkbra,washingtonpost.com,New bill would prohibit the president from nuking a hurricane,1,1,1591711593
1766,nottheonion,FenrirIII,wtsp.com,The president wouldn't be able to nuke a hurricane under a new bill,29,141,1591711106
1767,nottheonion,WackZoner,cnbc.com,The hot new thing to make your stock pop: Go bankrupt,2,30,1591710750
1768,nottheonion,[deleted],futurism.com,Scientists Claim the Universe Is Actually Flat,1,1,1591710090
1769,nottheonion,GoldenDrive,thesun.co.uk,"Man stuck in well for 6 days, locals believed cries for help were a ghost and ignored them.",1,1,1591709969
1770,nottheonion,Duraz0rz,washingtonpost.com,New bill would prohibit the president from nuking a hurricane,1,1,1591709835
1771,nottheonion,johntempleton,thehill.com,Trump to make it easier for Alaska hunters to kill wolf pups and bear cubs: report,1,1,1591709725
1772,nottheonion,[deleted],thehill.com,Trump claims 75-year-old man shoved by Buffalo police could be part of 'set up',0,2,1591709717
1773,nottheonion,[deleted],washingtonpost.com,Trump administration to make it easier for hunters to kill bear cubs and wolf pups in Alaska A ban against luring mothers from their dens with doughnuts and other treats will be lifted,1,1,1591709668
1774,nottheonion,GoldenDrive,apple.news,"Man stuck in well for 6 days, as locals thought cries for help were a ghost and ignored him.",1,1,1591709660
1775,nottheonion,1970251510,dailycaller.com,#FREEDOM#DEMOCRACY#FUTURE#HOPE#STAND WITH DEMOCRACY#STAND FOR HUMAN RIGHTS#STAND UP PEOPLE,1,1,1591709656
1776,nottheonion,[deleted],twitter.com,LAPD laughing with white vandal as she spray paints building - they even tell her to add “Floyd” so it would appear that it was done by protesters.,1,1,1591709571
1777,nottheonion,[deleted],businessinsider.com,A Maine factory says it will have to discard all coronavirus swabs made during Trump's factory tour,1,1,1591709571
1778,nottheonion,[deleted],eenews.net,Texas Dem wants to prevent Trump from nuking a hurricane,1,1,1591709527
1779,nottheonion,[deleted],washingtonpost.com,New bill would prohibit the president from nuking a hurricane,1,1,1591709250
1780,nottheonion,[deleted],mirror.co.uk,'Miss Hitler' beauty pageant contestant jailed for part in neo-Nazi terror group,1,1,1591708763
1781,nottheonion,Everindrummer,news.sky.com,Ex-Miss Hitler entrant jailed for belonging to banned far-right group,1,30,1591708679
1782,nottheonion,[deleted],standard.co.uk,Miss Hitler beauty pageant entry Alice Cutter among four neo-Nazi 'diehards' jailed for being members of National Action terror group,1,1,1591708197
1783,nottheonion,[deleted],mirror.co.uk,'Miss Hitler' beauty pageant contestant jailed for part in neo-Nazi terror group,1,1,1591708159
1784,nottheonion,Tommy__Douglas,thehill.com,Trump claims 75-year-old man shoved by Buffalo police could be part of 'set up',1,1,1591708141
1785,nottheonion,[deleted],telegraph.co.uk,Former Miss Hitler beauty pageant contestant jailed with three others for being National Action members,1,1,1591708083
1786,nottheonion,DrAnthonyFauci,courthousenews.com,Russian Historian Goes on Trial for Chopping up Lover,3,6,1591707947
1787,nottheonion,DrAnthonyFauci,courthousenews.com,Russian Historian Goes on Trial for Chopping up Lover,1,1,1591707903
1788,nottheonion,aguacateojos,usnews.com,Doughnut Shop Sparks Controversy By Ending Police Discount,1,2,1591707899
1789,nottheonion,[deleted],mirror.co.uk,'Miss Hitler' beauty pageant contestant jailed for part in neo-Nazi terror group,1,1,1591707883
1790,nottheonion,953edgehoyt,hindustantimes.com,Donkey arrested in Pakistan for gambling.,3,13,1591707555
1791,nottheonion,Tommy__Douglas,thehill.com,Law enforcement slashed parked car tires in Minneapolis amid protests,365,6948,1591707297
1792,nottheonion,ft1103,independent.co.uk,Trump says he hopes George Floyd ‘looking down’ and seeing today’s jobs numbers as ‘a great day for him’,1,1,1591707277
1793,nottheonion,L0rdLogan,imore.com,Saying “All lives matter” to Siri now redirects you to blacklivesmatter.com,1,1,1591707129
1794,nottheonion,Heavy-Addiction,cnn.com,Video shows police arrested a black man after he was seen dancing in the street,9,70,1591706938
1795,nottheonion,WhisperingPrivacy,msn.com,A Donkey Has Been Arrested in Pakistan Because it Participated in a 'Gambling Race',1,1,1591706911
1796,nottheonion,[deleted],cnn.com,Video shows police arrested a black man after he was seen dancing in the street,1,1,1591706893
1797,nottheonion,[deleted],bostonglobe.com,Allie’s Donuts sparks controversy by ending police discount,1,1,1591706626
1798,nottheonion,Tommy__Douglas,twitter.com,"Trump : Buffalo protester shoved by Police could be an ANTIFA provocateur. 75 year old Martin Gugino was pushed away after appearing to scan police communications in order to black out the equipment. I watched, he fell harder than was pushed. Was aiming scanner. Could be a set up?",1,1,1591706225
1799,nottheonion,1970251510,facebook.com,#FREEDOM#DEMOCRACY#FUTURE#HOPE#STAND WITH DEMOCRACY#STAND FOR HUMAN RIGHTS#STAND UP PEOPLE,1,1,1591705987
1800,nottheonion,BorkJork,globalnews.ca,RCMP adding incels to terrorism awareness guide,0,1,1591705849
1801,nottheonion,Sampledoubt,businessinsider.com,I have no words...,1,1,1591705464
1802,nottheonion,jaredmullin35,ottawacitizen.com,Dogs can detect virus infection by armpit scent,2,14,1591703553
1803,nottheonion,[deleted],ottawacitizen.com,Dogs can detect virus infection by armpit scent,1,1,1591703455
1804,nottheonion,slowmotionman92,news.sky.com,Former-Miss Hitler pageant entrant and her ex-partner jailed for belonging to banned far-right group,1,9,1591703361
1805,nottheonion,cats-inside-pants,opindia.com,"Pakistan: Donkey named in FIR, 'arrested' with 8 others for gambling and illegal racing",0,49,1591703359
1806,nottheonion,truongtungminh,thenews.com.pk,Indian TV channel accuses Pakistan of attacking India with hot weather,9,96,1591703257
1807,nottheonion,madridistamott,globalnews.ca,CANADA RCMP adding incels to terrorism awareness guide,0,1,1591703228
1808,nottheonion,NightpawsLupus,news.sky.com,Alice Cutter: Former-Miss Hitler pageant entrant and her ex-partner jailed for belonging to banned far-right group,1,2,1591703141
1809,nottheonion,[deleted],houstonchronicle.com,New bill would prohibit presidents from nuking hurricanes,1,1,1591703058
1810,nottheonion,anglomike,independent.co.uk,White House has ‘no regrets’ about tear-gassing peaceful protesters to clear way for Trump’s bible photo,1,1,1591703023
1811,nottheonion,Tommy__Douglas,iflscience.com,The US Space Force Could Face A Legal Battle With Netflix's Space Force,1,1,1591702542
1812,nottheonion,Tommy__Douglas,ign.com,Why Netflix and the U.S. Government May End Up in Court Over Space Force,1,1,1591702471
1813,nottheonion,1970251510,twitter.com,#FREEDOM#DEMOCRACY#FUTURE#HOPE#STAND WITH DEMOCRACY#STAND FOR HUMAN RIGHTS#STAND UP PEOPLE,1,1,1591702406
1814,nottheonion,Tommy__Douglas,rt.com,"US Space Force to lose 1st battle? Netflix already secured trademarks for self-titled show, reports say",1,1,1591702391
1815,nottheonion,[deleted],popularmechanics.com,"Whoops, the Real Space Force May Lose Its Trademark to the Fake One Turns out the U.S. military is pretty lax with logos.",1,1,1591702343
1816,nottheonion,u_wat_m8,youtube.com,Vandals target sand castles,1,1,1591702125
1817,nottheonion,1970251510,theepochtimes.com,#FREEDOM#DEMOCRACY#FUTURE#HOPE#STAND WITH DEMOCRACY#STAND FOR HUMAN RIGHTS#STAND UP PEOPLE,1,1,1591701458
1818,nottheonion,[deleted],google.com,Please Stop Making Protest Signs That Reference “Black Dick”,1,1,1591700989
1819,nottheonion,1970251510,twitter.com,#FREEDOM#DEMOCRACY#FUTURE#HOPE#STAND WITH DEMOCRACY#STAND FOR HUMAN RIGHTS#STAND UP PEOPLE,1,1,1591700797
1820,nottheonion,ranga_mullet,independent.co.uk,"UK should spend £100m on new royal yacht to lift nation's spirits, says former minister",1,1,1591700393
1821,nottheonion,1970251510,theepochtimes.com,#FREEDOM#DEMOCRACY#FUTURE#HOPE#STAND WITH DEMOCRACY#STAND FOR HUMAN RIGHTS#STAND UP PEOPLE,1,1,1591700235
1822,nottheonion,ranga_mullet,thelondoneconomic.com,"Lord Digby Jones calls for £100 million Royal Yacht to ""boost morale""",1,1,1591700199
1823,nottheonion,[deleted],businessinsider.com,New bill introduced that would stop a president from using nuclear bombs on a hurricane,1,1,1591699984
1824,nottheonion,Da_Mad_Jester,cbsnews.com,"New ""Looney Tunes Cartoons"" take away Elmer Fudd's iconic rifle: ""We're not doing guns""",17,28,1591699811
1825,nottheonion,GreyCatOrangeBeard,mobile.abc.net.au,Apollo Bay Distillery recalls gin bottles that are actually filled with hand sanitiser,1,20,1591699644
1826,nottheonion,1970251510,gofundme.com,#SAVEวันเฉลิม#ยกเลิก112#มีกษัตริย์ไว้ทำไม,1,1,1591699566
1827,nottheonion,AnishNoor92,youtube.com,Barsaat 1995 Cast Then and Now | #TwinkleKhanna #BobbyDeol,1,1,1591699455
1828,nottheonion,The_Amazing_Emu,theguardian.com,Protests about police brutality are met with wave of police brutality across US,567,21578,1591699275
1829,nottheonion,[deleted],mobile.abc.net.au,Distillary recalls hand sanitizer incorrectly labelled and sold as Gin,1,3,1591699205
1830,nottheonion,[deleted],usnews.com,Doughnut Shop Sparks Controversy by Ending Police Discount,1,1,1591699029
1831,nottheonion,[deleted],ndtv.com,"No Community Transmission In Delhi, But ""Source Unknown In 50% Cases""",1,24,1591697801
1832,nottheonion,Jple88,businessinsider.com,New bill introduced that would stop a president from using nuclear bombs on a hurricane,1,1,1591697308
1833,nottheonion,[deleted],nbc12.com,Commonwealth’s Attorney: Man who drove through group of protesters is leader of KKK,0,1,1591697050
1834,nottheonion,[deleted],clickondetroit.com,Man using submarine to smuggle drugs across Detroit River found tied to floating bags of marijuana,1,1,1591696386
1835,nottheonion,dlugo06,businessinsider.com,New bill introduced that would stop a president from using nuclear bombs on a hurricane,1,1,1591695792
1836,nottheonion,[deleted],dailymail.co.uk,"Man, 30, has a whole fish stuck in his rectum after 'sitting on it by accident'",1,1,1591695669
1837,nottheonion,dinus-pl,marketwatch.com,Russia urges the U.S. to ‘observe democratic standards’ and respect Americans’ right to protest,38,142,1591695660
1838,nottheonion,Sensatai,ctvnews.ca,"Rat disables ATM, eats $20,000, then dies",2,2,1591693667
1839,nottheonion,drjsins,desksloth.com,CSPD faces backlash for expressing displeasure at protestors wearing gas masks,8,32,1591692507
1840,nottheonion,1970251510,twitter.com,#FREEDOM#DEMOCRACY#FUTURE#HOPE#STAND WITH DEMOCRACY#STAND FOR HUMAN RIGHTS#STAND UP PEOPLE,1,1,1591692404
1841,nottheonion,th3h4ck3r,europapress.es,"Bolivia's Defense minister threatens citizen with making him ""disappear in 10 seconds""",1,3,1591691256
1842,nottheonion,nukeboi42,indianexpress.com,"Amit Shah: On Corona, we may have fallen short (but) what did Opposition do?",4,30,1591691021
1843,nottheonion,corpsefucer69420,miragenews.com,Police search for teenager with autism at Mount Disappointment,9,56,1591690776
1844,nottheonion,nickmhc,businessinsider.com,Congress introduced a No Nuking Hurricanes Act?,1,1,1591689947
1845,nottheonion,1970251510,twitter.com,#SAVEวันเฉลิม#ยกเลิก112,1,1,1591689319
1846,nottheonion,1970251510,hrw.org,#FREEDOM#DEMOCRACY#FUTURE#HOPE#STAND WITH DEMOCRACY#STAND FOR HUMAN RIGHTS#STAND UP PEOPLE,1,1,1591688753
1847,nottheonion,SqueeTheIII,christiansfortruth.com,Huge Spike In Gonorrhea Among Female Backpackers In Australia May Reflect Uptick In Race Mixing,7,0,1591688555
1848,nottheonion,THE_JEWISH_MONK,marketwatch.com,Russia urges the U.S. to ‘observe democratic standards’ and respect Americans’ right to protest,2,10,1591688158
1849,nottheonion,[deleted],news18.com,'Man-eater' Tiger in Sentenced to Life in Captivity for Being 'Too Dangerous',1,2,1591686992
1850,nottheonion,Spekulatius2410,marketwatch.com,Russia urges the U.S. to ‘observe democratic standards’ and respect Americans’ right to protest,7,14,1591686700
1851,nottheonion,thatkarmayogi,cnn.com,Florida police organization offers to hire cops who were fired or resigned over police misconduct,4,39,1591686615
1852,nottheonion,[deleted],cnn.com,A man put a cell phone charger up his penis -- it got stuck in his bladder and had to be removed by surgeons,7,13,1591685834
1853,nottheonion,[deleted],cnn.com,Florida police org strikes again...,1,3,1591685730
1854,nottheonion,Real_Carl_Ramirez,thecourier.com.au,"Fishing allowed, but there are no fish in the water",1,29,1591685464
1855,nottheonion,tiquismiquis123,nbcnews.com,Newspaper calls for KKK night rides,0,1,1591685301
1856,nottheonion,[deleted],reddit.com,Pure Onion material,0,1,1591685262
1857,nottheonion,[deleted],theguardian.com,Klan leader charged over driving car into Black Lives Matter protesters,0,1,1591684064
1858,nottheonion,DawntBeRude,marketwatch.com,Russia urges the U.S. to ‘observe democratic standards’ and respect Americans’ right to protest,59,641,1591683517
1859,nottheonion,THE_JEWISH_MONK,marketwatch.com,Wink wink,1,5,1591683365
1860,nottheonion,[deleted],marketwatch.com,This is getting out of hand,4,6,1591682922
1861,nottheonion,8BitMeowster,marketwatch.com,Russia urges the U.S. to ‘observe democratic standards’ and respect Americans’ right to protest.,4,2,1591682900
1862,nottheonion,amitsunkool24,newsd.in,"Bengaluru: Man records suicide video on TikTok to get death feels, dies",2,21,1591682554
1863,nottheonion,AnnArchist,startribune.com,"Officers slashed tires on vehicles parked amid Minneapolis protests, unrest",10,1,1591682368
1864,nottheonion,awesamn,marketwatch.com,Russia urges U.S. to ‘observe democratic standards’ and respect Americans’ right to protest,2,5,1591682137
1865,nottheonion,awesamn,marketwatch.com,Putin urges U.S. to respect Americans’ right to protest,5,9,1591681450
1866,nottheonion,[deleted],nbcnews.com,"In Klamath Falls, Oregon, victory declared over antifa, which never showed up",1,1,1591681443
1867,nottheonion,[deleted],forbes.com,"An Asteroid Bigger Than The Empire State Building Poses ‘No Danger’ On Saturday Night, Says NASA",1,1,1591680459
1868,nottheonion,[deleted],usatoday.com,"Texas police chase ends in death as 'Live PD' cameras roll. 'I can't breathe,' the man cries",2,7,1591679635
1869,nottheonion,fuckedbymath,independent.co.uk,"Please don't answer, it's 2020",1,1,1591679029
1870,nottheonion,kiralalalala,medium.com,"Men to teach women how to achieve true femininity. Yes, of course it's called Make Women Great Again",1,1,1591678916
1871,nottheonion,RubberSoul28,forbes.com,"Why The ACLU, Black Lives Matter And Others Want To ‘Defund The Police’ While This Weapons Supplier Disagrees",1,1,1591678754
1872,nottheonion,[deleted],businessinsider.com.au,New bill introduced that would stop a president from using nuclear bombs on a hurricane,1,1,1591678628
1873,nottheonion,[deleted],newshub.co.nz,Police commissioner confirms no more Armed Response Teams in New Zealand,1,0,1591675567
1874,nottheonion,PoissonsRevenge,marketwatch.com,Russia urges the U.S. to ‘observe democratic standards’ and respect Americans’ right to protest,4,13,1591675399
1875,nottheonion,[deleted],mynorthwest.com,Seattle Police Union Demands Elected Officials Condemn Violence Toward Officers.,1,1,1591675364
1876,nottheonion,bomdiggity10,alternet.org,Fox News displays chart showing that killing black people is good for the stock market,1,1,1591675329
1877,nottheonion,DaFunkJunkie,businessinsider.com,New bill introduced that would stop a president from using nuclear bombs on a hurricane,1,1,1591675147
1878,nottheonion,cnews97,thehill.com,Joe Biden's ideal VP is Condoleezza Rice,13,3,1591673834
1879,nottheonion,ASACSchraderDEA,9to5google.com,Google Chrome moving away from 'blacklist' and 'whitelist' - 9to5Google,4,0,1591673620
1880,nottheonion,[deleted],thehill.com,Virginia city removes slave auction block from its downtown corner,1,1,1591673513
1881,nottheonion,WhenItsHalfPastFive,foxnews.com,Burger King debuts 'social distancing Whopper' with extra onions: 'Helps others stay away',9,50,1591673135
1882,nottheonion,croma0910,dailymail.co.uk,Alex Jones honours the Black Lives Matter movement live on The One Show,1,1,1591671977
1883,nottheonion,jomtienislife,b1039.com,Speedway declares race a 'protest' to get around governor's coronavirus rules,5,10,1591671625
1884,nottheonion,zasahfrass,youtu.be,Life is a parody,2,1,1591671386
1885,nottheonion,[deleted],washingtonpost.com,Trump administration to make it easier for hunters to kill bear cubs and wolf pups in Alaska,1,1,1591671178
1886,nottheonion,lazylord69,cnet.com,Netflix snags Space Force trademarks ahead of US military,15,156,1591671111
1887,nottheonion,[deleted],thehill.com,Netflix secured trademarks for 'Space Force' before US military could: report,1,1,1591671042
1888,nottheonion,jomtienislife,washingtontimes.com,"Speedway declares race a ‘protest’ to skirt coronavirus rules, draws 2,000",1,0,1591670984
1889,nottheonion,SomeRoboDinoKing,reddit.app.link,"Some Muslims Using ""Halal"" Hand Sanitizer - With No Alcohol",2,2,1591670673
1890,nottheonion,Tommy__Douglas,thehill.com,Philadelphia police inspector gets applause from officers before surrendering on charges of assaulting protester,6,7,1591670574
1891,nottheonion,[deleted],cnn.com,Florida police organization offers to hire cops who have been fired for misconduct.,1,1,1591669850
1892,nottheonion,[deleted],lawandcrime.com,Newly Released Body Cam Video Shows Deputies Tasing Man Who Said ‘I Can’t Breathe’ Before He Died,20,173,1591669564
1893,nottheonion,dontdrinkthewater90,syracuse.com,"Man rammed car into smoke shop, stole whippets, got high, fought EMT who tried to help: deputies",11,6,1591669313
1894,nottheonion,SlightTumbleweed,aninews.in,"UP's malls open, shops in them to remain closed",0,15,1591669159
1895,nottheonion,[deleted],okayplayer.com,Teenager Lakeith Smith Sentenced To 65 Years For Death Of Friend Killed By Cop,1,1,1591669028
